왜 꿀강이라는지 모르겠음.. 아직 시험치기 전이긴한데 느끼는 거 그대로 말씀드릴게요1. 영전인데 도저히 알아들을 수 없는 발음(수업은 사실상 못듣는다고 보면됨)2. 시험 중간 기말 치는거 말고 A4 3페이지짜리 레포트(중간고사 기간에 내야됨)랑 5분짜리 프레젠테이션을 발표해야합니다. Ppt가 460페이지예요 물론 다 공부는 안해도 되겠지만 전날 벼락치기... 상당히 힘들어보이네요ㅜㅠ3. 출석은 안부릅니다 이게 사실상 유일한 꿀인 것 같아요.. 사실 이거 두개만 해도 꿀강은 아닌것 같네요.. 꿀강들 많이 들어봤는데 꿀강은 절대 아닌 것 같네요	0
그냥 교수님이 공부하라한 곳만 보면 퀴즈랑 시험 다 맞출 수 있어요. 시험도 2시간씩 공부하고 에쁠 받아갔슴니다.	0
퀴즈귀찮은거빼면 완벽 그자체입니다. 시험 쉽고 출결없고 그냥 개꿀	0
친절하게 설명해주셔서 좋았습니다.영어 못 해도 괜찮습니다	0
전공스러운 깊이, 실생활에 도움되는 경제지식2-3주마다 퀴즈준비하기 귀찮은거 빼면 다 좋았네요학점까지 잘 주심	0
투자자산운용사를 영어로 배우는 느낌. 따신분들은 개꿀일거같네여	0
교수님이 정말 친절하세요!! 밑에도 적혀있지만 학생을 정말 우선으로 생각해주시는 교수님입니다.	0
공대생인데도 경제+영전 과목에서 에제 받고 갔어요.학점 아주 잘주셔요.👍	0
영전 채우려고 들었는데 교수님이 너무너무 좋으신 분이었어요. 수업도 열정적이시고 학생들 모르는 부분 있는지 물어봐주시고 모르면 이해될 때까지 쉽게 설명해주세요. 제가 영어를 잘 못해서 수업시간에 못알아들은거는 교재로 다시 읽어보면서 공부했어요. 퀴즈도 핸드아웃 보면서 복습하면 충분히 풀수 있구요. 퀴즈 내용이랑 핸드아웃 쭉 일회독 하시면 시험도 좋은 점수 받을 수 있을거예요. 발표는 강의실에서 안하고 녹화해서 피피티랑 같이 제출했습니다.	0
문과+경제알못+영어못하는 학생임계절학기로 들었는데 교수님 진짜진짜 좋으심퀴즈나 시험은 전날에 예시문제나 요약 해주셨고 경제 관련해서 기본지식도 전~혀 없었는데 중요한 부분은 계속 반복설명 해주셔서 듣기 어렵지 않았음 저는시험은 걍 전날 요약본 보면서 피피티 파파고 돌려서 읽고 외웠는데 할만하고 과제도 금방 할 수 있음. 발표도 원하는 사람만 하는 거라 부담없고 학생들 다 있을 때 하는 것도 아니었음 (정규학기땐 어떨지 모르겠음) 수업 좀 일찍 끝내시고 발표할사람만 남아서 하고 가는 식으로 진행됨퀴즈나 시험, 과제 아예 안 한 거면 모르겠는데 하라는 것만 다 하면 비쁠 이상으로 다 채워주는듯함. 저는 발표 안 했고 과제도 가이드라인만 맞춰서 제출에 의의를 두고 한 데다 출석도 체크하는 날만 나가고 체크 안하다고 하신 날에는 거의 빠졌는데 비쁠 뜸영전 꿀강임 ㄹㅇ 추천	0
새로 오신 교수님이 수업도 정말 열심히 하시고 학생들을 인격적으로 존중해주시는 것이 너무 좋았음 학생들 눈 마주치면서 표정 이해 못한 거 같으면더 사례들어서 설명해주시고 해서 배워간 것도 많았음너무 좋으신 분이라 가끔 출튀한 게 너무 죄송할정도 ㅜㅜ	0
학점 받기도 편하고 교수님도 너무 좋아요 무조건 들으세요	0
한 3주 간격으로 간단한 quiz가 있습니다.중간 기말 그리고 간단한 동영상 발표 파일 제출로 성적을 평가하십니다. 생각보다 부담없이 들을 수 있는 수업입니다.	0
The professor is really nice and is passionate about the subject. Was glad that I took the class.	0
진짜 완전 꿀강의에요 강추합니당 과제도 어렵지 않고 시험도 괜찮습니다	1
교수님은 점수를 잘 주시고 엄청 좋으신 분인 것 같습니다하라고 하시는 것 다 하시면 무조건 에이쁠 받을 수 있습니다!!! 강추!!!	1
꿀수업 중의 꿀수업입니다..! 너무 쉬워요.	1
꿀강!!! 무조건 들으세요!!!!!! 시험도 오픈북이어서 만점 ㅆ가능입니다	1
중간/기말고사 시험은 퀴즈 방식으로 하고피피티를 읽으면 잘 풀릴 수 있고 과제도 관장히 쉬워요.다만 온라인강의 출석기간이 있어서 시간 관리 잘 해야되요.	1
엄청쉬움그냥 틀어놓고있으면 됨얻어가는것도 없고 그냥 그럼	1
시험은 기말 중간 있는데 피피티에서 피피티에 다 있는거라서 괜찮아요!추천!	1
Honestly I don’t think I learnt anything useful  from this course. After about 3 weeks, I ended up just playing the videos while I do something else. For the exam, I just read the PPTs one day before  and also had them open on my iPad during the exam. I was able to solve almost all the questions easily. There were also some questions on the exam that were in the quizzes so you can revise the quizzes while preparing for the exam. Easy A+	1
그냥 하라는 대로만 하면 에이쁠 나옴. 내용도 유익함.	1
간단하고 좋아요!셤은 주말에 봐요. 기본적인 한국어를 배울 수 있어요. 완전 기본 한국어 문법이런걸로요.	1
한국어 공부 많이 할 수 있습니다.추천!!추천!!추천!!추천!!	1
매주 간단한 과제 있음강의를 귀를 기울여 들으면 시험을 굳이 준비 하지 않아도 될 걸 같았음	1
봐야할 영상 좀 많는 편인 것 같아! 조금 지루웠어요.. 근데 점수 나쁘지 않았어요..	1
꿀수업! 외국 학생들에게 추천!온라인으로 녹화 수업을 해요.	1
녹강이라 시간날때 들어가서 보면 됨 부담도 없고 그냥 딱 외국인들에게 고급한국어임 나름 추천함	1
녹화 강의라서 미리미리 들어야 나중에 힘들수도 있습니다. 한국어에 대해 잘 알 수 있고 과제와 시험만  잘 보시면 에이플은 가능합니다!! 꿀강이에요^^	1
이번 학기는 녹화 강의입니다. 시험 내용이 모두 녹화 영상과 관련된 것이어서 결석하지 않고 과제와 시험을 열심히 하면 문제가 없습니다.	1
싸강이고 과제가 딱 한번 있어서 개꿀입니다!! 시험 두번 다 온라인으로 보고  퀴즈에서 똑같은 문제 나옵니다. 그리고 시간이 촉박할 수 있지만 답안 빨리빨리 찾을 수 있으면 만점 ㅆㄱㄴ. 다들 이 수업 듣고 에이쁠 받아가세요~	1
과제도 매주 있는데 할만 함. 시험도 강의 들으면 다 풀 수 있는 내용이리 너무 쉽고 유학생이면 강추!	1
교수님 좋으시고 점수를 잘 주셨습니다!! 중간시험 1개랑 기말시험 1개랑 과제 1개밖에 없습니다. 저는 에플 받아서 마음 너무 들었습니다!!	1
과제는 딱 한번 시험 두번 있었는데 전부 다 Quiz에서 냄A+	1
좋아요. 교수님도 친절하십니다.과제 부담이 없습니다	1
좋아요. 수업을 잘 설명해주셔서 쉽게 이해할 수 있었음.	1
본수업을 추천하지 않습니다수업은 교수님이 관심있는 주제에 대해서 이야기하는 방식으로 이루어짐오늘은 아프리카 티비에 대해서 심도있게 배웠음철구는 별풍선을 받지 않고 싶어하고 미션위주로 방송이 진행되는 것과 아프리카의 나락 극락 비난하는 문화 지금 가장 인기있는 게임 분야는 스타크래프트인 것 그리고 웅이?의 전여자친구가 때린것을 폭로했다는 것 등등앞으로 선정되는 주제들도 이와 크게 다르지 않을듯함영전수업이고 한국원어민 발음으로 직역한듯한 영어를 구사하심수업을 짧게 하셨다면 앞서 언급한 것들을 그래도 감수하면서 들었을 것 같음 수업의 방향성에 일관성은 있는거니까(배우는게 없는 짧은강의) 근데 풀강임 수업시간을 채우는 교수님 앉아있어야하는 학생들 모두 불행인 강의	2
꿀강본인 스페인어 배운적 있다하면 너무 쉽게 A+받아갈 수 있음!내가 들을 땐 출결도 체크 안하심 ㅎ	3
이 교수님은 쁠채워주시기 때문에 열심히만 하면 에쁠 확정임. 학생들 정말 많이 생각해주시고 수업도 열정적으로 하시나 간혹 지나치게 깐깐하신 경향이 있으시긴 함. 그래도 중간고사 없고 수업 열심히 들은 학생이 성적 잘 받아간다는 점에서 정당하고 멋진 수업이라 생각. 수업 내용은 스페인어 회화보다는 문법에 비중을 두심.	3
강평이 좋아서 수강했으나 같은 교수님 수업이 맞나 싶을 정도로 본인에게는 잘 맞지 않았던 수업결론적으로 성적은 잘 나왔고 수업도 어렵진 않았으나 교수님과의 성향 차이였던 것으로 생각됨논리를 매우 강조하시고 그 논리를 따라오지 못하는 학생들을 다그치고 통제하려고 하시는 경향이 있으셔서 수업 내내 피로감을 느낌모르는 부분에 대해 질문을 하면 ’이 부분이 공부가 안 돼서 그렇다, 질문 내용이 이해가 안 된다, 수업 시간에 다 설명한거다‘ 등등의 꾸지람을 1분 정도 들은 뒤에 불친절한 답변을 받을 수 있음교수님이 나쁜 분은 아니신 것 같지만 본인은 한 학기 내내 스트레스를 받음수업 내용 자체는 크게 호불호를 탈 수업이 아니라 교수님과 성향만 잘 맞는다면 좋은 수업이 될 수도 있을 것..	3
재밌음. 시험 기말 한번에 오픈북인데 오픈북 믿고 공부 안하고 가면 큰일남. 출결도 없는데 그만큼 자기 손해.	3
오픈북이라고 공부안하고 가면 절대 안됨문제 난이도는 그렇게 어렵진 않음 한만큼 나오는듯	3
스페인어 처음 배우는 입장에서 어렵지 않게 배울 수 있었습니다. 강의 형식은 뭔가 제가 느끼기에 수능 제2외국어처럼 어떤 문제 풀기 위한 지식 전달 느낌으로 진행하십니다. 엄청 규칙과 논리(?)를 강조하시면서 문법적인 내용을 다루십니다. 덕분에 이런 형식화된 부분들은 오히려 공부하기 편했습니다. 다만 시험 유형이 매우 어렵습니다. 시험이 다루고 있는 내용은 대부분 수업 때 말씀하신 것들이고 교안에 있기에 어렵지 않은데 태어나서 처음 보는 시험 형태입니다. 스크린에 문제와 선지를 보여주시고 5분이 지나면 다음 문제로 넘어가고 답은 정답지에만 쓰는 형태인데 선지가 8개나 되다보니 시험지를 직접 받아서 풀었다면 소거하면서 풀기 편했겠지만 스크린상에 문제들을 풀려니 어색하고 적응하는데 꽤 오래걸려서 어렵게 느껴졌습니다. 과제도 부담없고 출결도 없어서 매우 편하게 수강하였습니다.	3
출결 없고, 스페인어 학원다니는 느낌을 많이 받았습니다. 아무것도 몰라도 수강할 수 있으며 과제도 적은 편입니다.	3
스페안어 하나도 모르는데 에이쁠 받았어요!근데 실생활에서 쓸 수 있는 문장들을 많이 배웠으면 더 좋았을 것 같아요	3
언어를 원리원칙 그 과정을 설명해주셔서 이 수업을 듣고 혼자서 더 공부한다면 스페인어를 매우 잘 배울 수 있지만 교수님이 가르쳐주는것만으로는 스페인어 실력이 향상되지는 않아요그와 별개로 교수님은 매우 친절하십니다!	3
처음으로 영어가 아닌 다른 언어를 배우게되었는데, 너무 즐거운 경험이었습니다. 특히 교수님이 친절하시고 질문 답변도 잘 해주셔서 공부하기도 수월했던 것 같습니다. 스페인어가 낯설어서 수강하기 망설이실 분들이 많을 것 같은데 수강하시면 즐거운 한 학기 보내실 수 있을 것 같아요 ㅎㅎ ¡vamos!	3
나쁘지 않음 다른 언어과목에 비해 스페인어를 공식으로 해석해서 수업하시는데 개인적으로는 괜찮았음 출석점수가 없지만 그에 따라 시험문제를 풀지 못하는 건 본인이 감수해야할듯	3
진짜 이거 꾸준히 공부안하면 개망함 ㄹㅇ임 진짜 후회하지 말고 이거 들을거면 매주 수업 열심히 듣고 복습해야함	3
교수님이 너무 좋은 분이셨지만 얻어가는건 별로 없는 수업..	3
교수님 굉장히 좋으신 분입니다. 출결점수 없을 정도로요. 근데 출결 안하시고 노는건 본인이 시험에서 감당하셔야 할듯.시험이 어려워서 한 번 없는 것이 좋긴 하지만 엄청난 메리튼지는 모르겠습니다.	3
올해 한양대 첫 강의라서 수업이 원활하지 못한 점도 있었지만, A+ 잘 받아갔습니다. 과제는 동사변형과제랑 문화과제 내주시는데 반나절만 투자하면 됩니다. 시험은 기말 하나만 보고 오픈북인데, 수업 잘 안 들으면 시험 문제 하나도 손 못 대니까 평소에 공부 많이 하셔야 해요! 가산점도 많이 주셔서 실제로 기말고사 만점보다 더 높은 점수 받았습니다. 다른 친구들 성적은 모르겠지만, 교수님만의 성적 기준이 있으셔서 B이하는 비율 꽉 채워서 주는 것 같진 않고 절대평가식으로 성적 매기시는 듯? ㅈㄷㅎ 교수님 수업도 들어봤는데 ㅈㄷㅎ 교수님이 고량주라면 박숙희 교수님은 과일소주 느낌임. 정석으로 스페인어 배우고 싶으면 ㅈㄷㅎ 교수님 추천	3
에이쁠 받긴 했지만 정말 ‘언어로서’ 스페인어를 배우고 싶다면 조금 고민해봐야 할 듯. 시험을 보기 위해 교안을 공부하는듯한 느낌이었고 난이도도 있어서 아예 초급자라면 조금 버거운 수업일 듯 하네요. 그래도 교수님이 성적 잘 주시고 가산점 후하게 주려고 하시는 점이 눈에 보였어요.	3
교수님이 암기를 싫어하셔서 새로운 방식으로 언어를 배울 수 있어 좋았어요. 시험은 좀 어려웠는데 과제도 거의 없고 과제랑 퀴즈 둘다 부담되지 않았어요!	3
알찬 강의였습니다. ჱ̒ ｰ̀֊ｰ́ )시험이 좀 어렵긴 했지만 퀴즈나 과제는 쉬웠어요!	3
학생들 배려 많이 해주시고 원리 위주로 가르쳐주세요. 개인적으로 열심히 하면 얻어갈게 많다고 생각합니다.	3
개인적으로 부담되지 않고 학생들 편하게 해주시려고 하는 게 보여서 너무 좋았어요	3
교수님 친절하시고 학생들 졸려할 때마다 역사얘기 등 화제전환도 많이 하세요 좋습니다	4
수업재미있는데 시험은 날려내시는것 같음그래도 수업시간에 배운거만 다 외우면 에이플	4
교수님 너무 재밌으시고 수업도 빡세지 않아서 좋았어요! 기말고사는 조금 어려웠는데 그럼에도 성적 다 쁠 채워주셔서 만족했습니다!!	4
강의는 정말 재밌고 배워가는 게 많은 거 같은데생각보다 암기할 게 많아서 힘들어요	4
스페인어에 진심인 강의..시간 투자 많이 해야하지만 그만큼 얻어갈 게 많은 과목입니다	4
길게 말 안 함… 기초스페인어를 꼭 들어야 한다면 ㅂㅅㅎ 교수님 들으세요	4
스페인권 문화와 같이 설명해주셔서 정말 재밌습니다.온라인강의와 함께 진행하여 수업시간에 놓친부분도 정리할 수 있어요.	4
교수님이 잘가르치시고 열정이 넘치심재밌고 얻어가는게 많아요	4
강의 열정적으로 하시고 내용도 재밌습니다. 언어를 배워가기도 하지만 라틴계 국가들의 역사와 문화에 대해 수업 중간중간 알려주십니다. 성적만 잘 받겠다는 생각보다는 다른나라 문화 설명 강연이라고 생각하고 들으면 정말 유익한 수업이라고 생각될겁니다. 재밌고 즐겁게 들어서 에이쁠 나왔습니다. 언어 교양수업은 고등학생 때 혹은 입학전이 취미로 배운 학생들이 많아서 걱정했는데 꾸준히 하시면 그 사람들과 같은 성적 받을 수 있습니다.	4
교수님이 중간중간에 라틴 문화 알려주시는 것도 재밌고 수업도 학생들 따라올정도로 진도 나가서 좋았어요학생들 적극적으로 지도해주세요	4
성적은 쁠 채워주신다고 직접 말씀하셨어요우선 교수님이 정말 좋으신 분이고 교양다운 교양이었던 것 같습니다다양한 설명을 해주셔서 스페인어나 라틴계 문화에 관심있으신 분이라면 더욱 좋은 수업이라고 느끼실 것 같아요! 수업시간에서 한 것 이상으로 시험이 나오지는 않아서, 수업 열심히 들으시고 책에 나오는 본문이나 구문 암기하시면 충분합니다 과제로 내주시는 것도 시험에 나오니 꼭 챙겨보세요언어 과목 특성상 복습을 꾸준히 하시면 더욱 수월할 것 같지만 전날 하루 빡세게 공부하고도 A+ 받긴 했습니다! 시험은 작문 중심으로 나오니 꼭 시험 전에 미리 써보시길 추천드립니다개인적으로 얻어가는 게 많았던 강의라 좋았어요!	4
교수님이 스페인에 진심이십니다.  수업을 정말 열정적으로, 재미있게, 지루하지 않게 해주시고 중간중간 학생에게 부담되지 않는 가벼운 질문을 하시거나 시키는 것도 많이 하셔서 졸릴 틈이 없었습니다.	4
시험이 어려웠습니다작문을 좀 더 꼼꼼히 연습하는게 중요해보여요	4
출석 쉬는시간 이후에 부르심, 시험은 본문 다외워야 쓸수있어요	4
계절에 들으시는걸 추천드립니다. 힘들긴 해도 금방금방 배울 스 있고 성적도 잘 주시는 편입니다!	4
교수님은 친절하지만 심험은 생각보다 어려웠어요… 공부 열심히 해야 합니다!!	4
인생 교양이었습니다다른 언어를 배우는 즐거움을 깨닫고 갑니다라틴도 듣고 싶어요	4
외울 것이 많긴 하지만, 스페인어에 흥미가 있으시다면 아주 좋은 수업입니다! 교수님께서 설명도 이해하기 쉽게 해주시고 잘 도와주십니다	4
쉽고 재밌게 배울 수 있는 강의과제도 없고 편하게 들을 수 있어서 좋음	4
교수님 너무 좋으시고 수업 시간에 이런 저런 얘기 많이 해주셔서 흥미롭게 들은 수업입니다! 강추해요!!	4
계절로 들었습니다제가 1학기동안 들었던 수업 중 제일 재밌었고 제대로 스페인어에 대해 공부할 수 있었습니다시험은 살짝 어려우나 공부하면 성적은 후하게 주십니다!!	4
교수님 강의력 진짜 최고.. 정말 최고…시험 준비는 다 외워야 해서 어려우나 언어 좋아하시면 공부할때 즐겁고 또 금방금방 외우실 수 있을 거에요!!그리고 교수님이 하라는 과제 꼭 하시길 바랍니다…! 교수님이 공부 더 해보라고 과제를 내주시는데 과제라고 하기도 뭐할 정도고 5분이면 끝나는 과제라 꼭꼭 하시길 바랍니다!!	4
ㅋ ㅋ ㅋ ㅋ ㅋ ㅋ 완벽하게 공부를 안 했더니,,,, 흡,,9시 수업이라 많이 졸리지만 교수님께서 수업 재밌게 해주셔용중간중간 스페인이나 다른 나라 이야기도 해주시구요~!~!	4
교수님 질문도 잘 받아주시고 친절하십니다. 수업도 알차게 진행됩니다. 힘든 점은 시험범위가 많아서 기말때는 피보신다는 점입니다.. 그렇지만 기말 때 사람들이 많이 손 놔서 완전 포기만 안하시면 에쁠 가능할거에요	4
언어를 배우는 것이라 외울게 좀 있습니다. 하지만 강의 잘 들으시고 복습만 좀 하시면 성적은 보장됩니다. 교수님이 되게 친절하시고 강의 자체도 널널하게 진행되는 편입니다.	4
단언컨대 이번학기 본인이 가장 사랑한 과목.. 수많은 전공 중 한줄기 빛.. 교수님이 그렇게 좋다고 소문이 자자하길래 들어봤더니 역시나 빛동희였습니다 전학영과 금요일 아침잠을 포기하고 1픽으로 잡은 보람이 있습니다 교수님이 학생들과 스페인어에 대한 열정이 아주 가득하십니다 하하 물론 시험은 하나도 안 쉽고요 학점 날로먹는 개꿀과목도 전혀 아니지만 대학 교양의 묘미를 느낄 수 있음⭐️1. 수업 절대 빠지지 마세요 졸지도 말고.. 수업 시간에 필기하는 게 굉장히 중요합니다 교과서에 없거나 보충하는 내용, 중요한 부분 판서로 해주시는데 그거 다 나와요 그대신 교수님 강의력이 굉장히 좋기 때문에 수업만 들어도 반은 갈 수 있습니다 솔직히 수업만 잘 듣고 집가서 B러닝 한번씩만 더 들어주면 조금만 공부해도 에이쁠 받을듯2. 학점은 쁠을 모두 채워주시겠다고 선언하셨습니다3. B러닝과 연습문제, 판서에 나오는 단어들이 시험에도 나오니 보세요4. 필수 과제는 없습니다 하지만 교수님이 할 사람들은 연습해보라고 강의자료실에 파일 올려주시는데 그거 하고 서면 튜터링으로 제발 검사받으세요 제 말 들어서 나쁠 게 없을 것임5. 모르는 부분 튜터링 신청하면 굉장히 상세하게 설명해 주시니 잘 활용하길 바람6. 교수님이 푸를 닮으셨는데 상당히 귀여우십니다 밑에 강의평에서 교수님이 시험시간에 자꾸 말거신다고 했는데 진짜였음 2년만의 대면강의로 굉장히 신나신것 같았어요7. 시험은 매우 지엽적임^^....근데 암기는 언어의 어쩔 수 없는 숙명이니까 그럴 수 있다고 생각해요 그래도 중요하다고 강조하신 부분에서 다 나옵니다 죄다 안 외워도 좋은 점수 받을 수 있습니다 작문이 거의 50퍼를 차지합니다 작문하려고 공부하니까 제대로 공부하게 되는듯;ㅋㅋㅋ 다들 그렇게 열심히 하지 않기 때문에 조금만 해도 잘 받을 수 있습니다8. 수업시간에 스페인어만 하는 게 아니라 관련 썰이나 유럽 역사 같은 것도 풀어주시는데 앞뒤배경 알고 하니까 기억도 잘 나고 재밌음기초스페인어 쵝오^^교수님사랑해오	4
교수님 좋으시고 학생들에게 매우 잘해주십니다.다만 시험이... 암기량이 많습니다	4
교수님이 정말 좋으십니다. 강의역량도 매우 뛰어나시고 B-러닝 수업도 이해도가 좋았습니다.하지만,하지만 정말 외울게 많습니다. 그냥 과목이 나빠요,, 교수님은 정말 최곤데....진짜 제발 학점 널널할  때 들어주세요 제발 제 피가 뭍은 강의평입니다.. 제발.,.. 무시하지 말고요 절대 새내기는 듣지 마세요...	4
외울거 많음...한가할때 듣는 거 추천수업은 세세하게 잘해주심 필기 중요하고 전부 서술형이라 암기 제대로 안 되어있으면 시험문제 사실상 못 풀음	4
교수님 친절하고 꼼꼼하게 잘 알려주심. 복습 열심히 하고 성실하게만 하면 됨	4
교수님이 일단 진짜 좋으시고 단점이 하나 있다면 실강에서 자꾸 지목해서 질문하신다는거 딱 하나입니다 시험은 교수님이 말했던 거에서 다 나오고 작문이 엄청나게 큰 비중 차지합니다 강세도 중간 기말에서 둘다 중요하지만 다 버리고 작문만 해도 반타작 이상은 맞을정도로 작문 비중이 큽니다!! 꿀교양이라기 보다는 하는만큼 나오는 것 같아요 그럼에도 이 강의가 이렇게 인기있는 이유는 교수님이 좋은 분이셔서가 아닐까 생각해봅니다	4
교수님은 좋으심. 음.. 근데 잘 모르겠음.. 잘 가르치시고 시험도 쉽긴 한데 엄청 꿀교양은 아닌 것 같음 개인적으로 쉽지 않았던 교양	4
교수님께서 기초 문법부터 하나하나 알려주시고 시험의 난이도도 높은 편은 아닙니다. 하지만, 그러다보니 시험 점수의 평균이 높습니다.	4
공부 거의 못하고 시험봤는데도 A+ 받을 정도로 성적 잘 주십니다! 아마 중간, 기말 모두 오픈북 시험이라 가능했던 것 같네요..코로나 상황이 심해지지 않는 이상 기말은 거의 대면으로 보시는 것 같고, 가끔 불시에 출석체크하시니까 꼭 실시간 수업 들으세요!	4
스페인어 처음 배우는 사람이 편하게 듣기 좋은 수업이에요 진도도 많이 안나가시고 외울 단어의 양도 엄청 많지는 않아요 교수님이 정말 차근차근 설명해주시기 때문에 큰 어려움 없이 수강 할 수 있었습니다.	4
교수님 덕분에 스페인어가 재밌다는 것을 알게 되었습니다. 정말 잘 가르쳐주십니다! 다만 시험은 교재를 달달 외우셔야합니다!!	4
명강의. 성수일치 굉장히 짜증남 조심할 것. 필기 잘할 것.	4
교수님 너무 귀여우시구.. 강의도 재밌고,,, 완벽했어요,,,,,💗진짜 이번 학기에 들은 수업중 가장 배운게 많았던 것 같아요🤩	4
울 교수님!!!너무 친절하시고 학생들 아끼는거 보여서 너무 젛아요한명씩 비대면인데도 다 튜터링해주샤서 감사해요 히히	4
스페인어를 기초부터 배울 수 있는 유익한 강의이고, 교수님의 강의력도 매우 훌륭하다.	4
