개꿀강의는 아닌듯. 기말비중이 높아서 시험 한번에 모든게 결정나기때문에 그런거 부담스러운 사람은 그냥 청강하세요. 수업은 재밌게 들었지만 제 성적은 재밌지않았습니다. 그리고 기출 족보 다 필요없을듯 저번에는 지도 나온다해서 그거 개열심히 봤는데 이번에 인물 연도 위주로 나옴ㅎㅎ	7
진짜 졸업 전에 꼭 들어봐야 할 강의 스페인 홍보대사인 줄 스페인 꼭 가고 싶다는 맘 반드시 들게하는 수업	7
개꿀개꿀개꿀개뀰개꿀개꿀개꿀개뀰개꿀개꿀개꿀개뀰개꿀개꿀개꿀개뀰개꿀개꿀개꿀개뀰개꿀개꿀개꿀개뀰	7
강의는  정말 명강의다 이렇게 강의력 좋은 교수님 만나뵙기 힘들다.  그러나 시험지를 받아드는 순간  당신의 생각은 조금 달라질지 모른다	7
한양대에서 졸업하기 전에 꼭 들어봐야하는 강의라고 해서 들었습니다.  암기할것이 많다고 해서 걱정도 많이 했는데 수업 자체가 정말 재밌었습니다. 2시간이 정말 빨리 지나가요. 교수님 수업하시면서 여러 이야기도 같이 해주셔서 더 재밌게 수업 들었던거 같습니다!  중간은 과제대체였고 기말은 시험입니다. 시험은 외우는것도 중요하지만 필기 꼭 잘 하셔서 같이 공부하셔야 합니다. 그래도 진짜 교양 재밌게 들었습니다!	7
한양대 명강의만 골라듣고 있는데, 명성이 아깝지 않을 정도로 재밌습니다! 걍 가서 강의들으며 개콘마냥 신나게 웃으시고 오시면 되요! 과제가 30% 정도로 알고 있는데, 아무리 못해도 26~27 주겠지 하면서 개대충했는데 나중에 24~25면 잘맞은거라고해서 개멘붕....이었지만! 결국 시험3개틀렸음에도 에이쁠.... 비쁠나올까봐서 조마조마할필요 없었던것같아요.  시험공부는 평소에 수업끝나고 궁금한거 있으면 네이버 찾아보고 (레닌, 트로츠키나 카스트로... 미술품 구글링 해서 구경), 시험전날 딱 7~8시간 공부했는데 3개 틀렸어요. 제 생각에 시험을 2~3일 전부터 미리미리 공부했다고 해서 성적올라갈건아니구요. 교수님 수업 열심히 듣고 필기 다적는게 굉장히 중요해서 정보 좀 부족하시면 시험 전날 아무리 벼락치기 하신다고 해도 에이쁠맞기 힘들거에요. 쨌든 강추!	7
감히 한양대 탑 5 안에 드는 강의라 할 수 있는 명강의입니다. 다만 시험 때문에 부담이 될 수는 있지만 열심히만 하면 성적은 잘 나오고 쁠로 채워주시기 때문에 내가 노력만 하면 안될건 없다고 봅니다. 얕고 넓게 배우기 때문에 수업 들을때는 정말 부담없이 들을 수 있구요 강의력 정말 좋으시고 교수님도 너무 좋으십니다 정동희 교수님 최고에요 !!!	7
진심 이건 명강이라고 생각함 글로벌영역은 꼭 이걸로 채우라고 말해주고싶을 만큼 재밌는 수업	7
글로벌언어와문화영역 이수 학점을 다 채웠는데도 라틴아메리카 수업이 너무 재미있다고 소문나 있어서 수강신청 때 제일 먼저 잡았습니다. 소문대로 정말 교수님 강의력이 좋으시고 재미있어서 수업 내용에 몰입했던 것 같습니다ㅎㅎ 출결, 중간고사 대체 과제, 기말고사로 평가하는데 중간고사 대체 과제로는 수업 내용과 관련된 PPT 과제를 내주셨습니다. 스페인과 중남미의 광고가 주제였고 20페이지 분량으로 만들어서 교수님 이메일로 보냈습니다. 기말고사는 교재에서 진도 나갔던 부분이 모두 나왔는데 중간고사가 없다보니 기말고사 범위가 상당합니다. 시험 기간에 한꺼번에 할 생각하고 들으시면 다른 과목 공부를 못 하실 수도 있으니 수업 시간에 필기를 하셔야 합니다. 성적은 공부한 만큼 정직하게 나오는 것 같습니다!	7
아 정동희 교수님은 진짜 제 인생 교수님...정말 강의력 한양대 최고이고 사랑합니다공부는 학생이라면 당연히 열심히 해야죠 ㅎㅎㅎ 그러면 학점은 한 만큼 나온답니당!강의 듣고 나면 스페인으로 직행하고 싶어집니다 정동희 교수님 너무 사랑해서 이번에 스페인어 교양 들어여 ㅎㅎㅎㅎㅎㅎ	7
대형강의로 출석은 전자출결이며, 과제는 한 번(매 학기 주제가 다름. 이번에는 스페인 광고의 특성에 관해 조사하는 ppt) 있고 중간고사 대체입니다. 교수님께서 출처 쓰는 것을 중시하시며 분량을 20장 이상으로 하라고 하셨던듯 합니다. 기말고사는 책 한권 범위이며 매번 시험 스타일이 바뀝니다. 이번에는 8지선다형으로 시험볼때 굉장히 당황했습니다... 그러나 교수님 강의력이 좋고 재밌습니다. 열심히 수업듣고 공부할 자신 있으면 들으세요~	7
전반적인 유럽사, 그 외에 스페인의 건축, 음식, 와인 문화 등 교수님이 스페인 사실 때 경험과 병행되어 수업을 하셨는데 엄청 유익하고 재밌었음.스페인 수업을 반 정도 하고나면 중남미에 대한 수업을 하는데 나라들 전체젹, 개별적 특성과 각종 문화를 배운다.교수님도 이 수업은 얕고 넓다고 하시는데 그만큼 부담도 없고 즐겁게 수업을 들을 수 있다.	7
교수님도 좋고 수업도 재밌다. 단, 시험 성적 잘 받으려면 생각보다 노력해야 함. 기말 시험범위  ppt 양이 꽤 된다.	7
교수님이 엄청 열정적이시고 수업이 재밌어서 정말정말 추천하는 명강의! 또한 열심히 하는 만큼 점수가 나올 수 있다!	7
팀블로그 만들기나 팀영상 만들기 다 팀원분들 잘 만나서 어렵지 않았고 재밌는 수업이었던 것 같아요 ! 성적도 잘 받았습니당:) 이안 교수님 건강하시고 행복하세요!~!~!~! 할 것들이 굉장히 많지만 시험이 없어서 저는 좋았습니다 ㅎ	8
23 여름 계절로 들었습니다. 첫날 LMS에 간단한 자기소개를 올리면 그 내용을 바탕으로 조를 만들어주십니다. 교수님께선 굉장히 유쾌하시고, 학생들과 프로젝트 진행과정에도 관심이 많으셔서 저도 자연스럽게 적극적으로 수업에 참여할 수 있었던 거 같아요. 좋은 팀원분들을 만난 덕에 매일매일 즐겁게 수업을 들었습니다! 초반에는 거의 매일 수업 시간이 끝나기 전까지 과제를 제출해야 됐었는데 부담되는 과제는 전혀 아니었습니다. 후반부에는 블로그랑 비디오를 만드는 과제가 있는데, 제출하기 이틀 전에 팀원분들과 따로 시간을 낸 것을 제외하면 모두 수업 시간을 활용해서 과제를 끝냈습니다. 계절로 들으시는 걸 추천드려요. + 중간, 기말시험 없고 과제랑 참여 점수로 성적을 주십니다!	8
나름 열심히 했지만 학점은...성적 기준이 궁금해진다웹디자인이나 vlog만드는걸 좋아하는 학생이면 배울게 조금이나마 있겠지만 그 외의 경우엔 학점 채우는 용도인거 같다.	8
계절로 하기엔 교수님 스스로도 intensive course라고 할정도로 빡센 수업뭘 하라는지 정확하게는 모르겠지만 우당탕탕 하다보면, 그리고 따라가기만 하면 학점은 매우 잘 주십니다.그리고 팀플로 한 학기 내내 진행하는 수업인데, 좀 열심히 하면 어디가 덧나나...어쨌든 교수님은 친절하십니다	8
교수님 친절하십니다. 과제는 미리미리 하면 부담 될 수준은 아닙니다. 무난하게 듣기 좋은 영전	8
매주 할게 조금씩 나오긴 하지만 부담되는 정도는 아닙니다. 교수님도 친절하세요.	8
교수님이 다 쉽게 설명해주시고 천천히 따라가면 됩니다. 영어 못해도 할만합니다..	8
과제가 막 어렵진 않은데 막판에 몰리는 스케줄이라 미리미리 준비 해두는 게 나을 것 같아요 그리고 교수님이 설명을 두리뭉실하게 하셔서 예시를 보여달라고 하시는게 편합니다. 그래도 성적은 잘 주세요!	8
해야하는 것들이 굉장히 많습니다..! 영어는 잘 못해도 듣는 데 지장 없는데, 교수님께서 내주는 과제의 양이 많아서 조금 부담됐어요	8
21년 겨울 계절 수강했음. 에타에서 흔히 볼 수 있었던 교수님에 대한 안좋은 평 때문에 조금은 걱정했으나, 전혀 걱정할 필요 없었음. 계절학기 특성상 인텐스해서 매일매일 해야되는 과제가 생각보다 귀찮았지만 교수님께서 모르는 부분에 대해서 아주 친절하게 알려주셔서 금방 끝낼 수 있었음. 교수님께서는 굉장히 열정적이시고 하나라도 더 도와주려고 하심. 다만 영국분이시고 말을 빨리 하시는 경향이 있어 영국 발음에 익숙하지 않다면 교수님 말씀 다 캐치하는데 어려울 수도 있을 것 같음	8
겨울 계절학기로 들었는데 평소에 블로그나 작성 영상 만들기 편집을 좋아하면 강추 시험 없고 매주 간단한 과제 내주심 부담스럽지 않는 양의 과제라 할만했음	9
교수님은 엄청 착하시고 영어 못해도 쉽게 들을수있음! 수업 내용이 재밌고 쉬운데 매주 과제가 있어서 좀 귀찮음….	9
교수님 열정있으시고 채점 깔끔하고 좋으십니다. 계절학기 내내 과제 때문에 고생했지만 개인적으로는 그 과정에서 많이 배워서 좋았습니다. 블로그 포스팅,콜라주 영상 만들기, 인포그래픽 만들기, 밈만들기 등의 과제가 있었어요. 브이로그 만드는 것도 있는데 우리가 아는 그 "v-log" 이런 걸로 한정된 건 아니고 그냥 유튜브 콘텐츠라고 생각하시면 될 것 같아요. 재밌는 경험이었지만 학점은 좀 짜게 주시는 것 같네요	9
교수님은 좋으신데 할게 너무 많아요..조별과제 싫어하면 절대 듣지 마시고브이로그랑 블로그 포스팅 팟캐스트도 있으니 잘 생각하고 들으세요.. 스트레스 오집니다.학점은 생각보다 안주세요	9
진짜 할 게 너무 많음.. 교수님은 좋지만 조별과제가 굉장히 많고 한 프로젝트 당 수행해야할 게 너무 많으며, 조원이 다 영어밖에 못하는 외국인이 걸리면 힘들어지는 수업..	9
과제나 수행해야할 프로젝트들이 많지만 교수님의 요구사항이 명확하여 그대로만 한다면 좋은결과 얻을 수 있을것입니다.	9
매주 과제가 있음블로그 글쓰기, 인포그래픽, 브이로그, 밈 만들기 등등인포그래픽, 팟캐스트는 팀플로 만듬시험 없는건 좋음열심히 했어서 A+ 기대했는데 A0받음 성적 은근 빡셌나봄그래도 난 미디어 제작하는거 좋아해서 괜찮았음	9
할거 엄청 많음. 내성적이면 하지 말것을 추천드림. 인포그래픽 만들이랑 중간, VLOG랑 기말 겹치면 진짜 죽어남	9
For foreign students who are interested in being an influencer or blogger, this would be a great lecture for you, it's not hard to get an A+ if you follow the requirements that is indicated in the rubric. There's no exams in this lecture nor quizs, but there is assignments for almost every week	9
과제 엄청 많다. 블로그 등 이런 쪽에 재능이 없다면 비추.	9
영어 정말정말 못하는데 수업 중 있는 조모임에 참여 열심히 하고, 과제도 기한이랑 평가사항 맞춰서 최선을 다했더니 학점 잘 나왔습니다! 교수님 정말 친절하시고 학생 신경 많이 써주세요! 저는 재미있게 들었지만 조모임 부담스럽고 과제 많은 거 싫어하시는 분들에게는 비추입니다..	9
브이로그, 팟캐스트, 밈 만들기 등 굉장히 재밌는 과제를 주시기는 하지만 과제 양이 많고 시간이 많이 필요합니다. 영어에 자신이 없는데 영전을 들어야 한다면 이 강의 추천합니다!	9
시험은 없으나 매주 해야하는 과제가 많고 귀찮음. 대신 과제 가이드라인만 잘 지키면 과제 점수는 잘 주심. 매주 조별로 모여서 얘기하고 영상 브이로그, 팟케스트도 만들어야 해서 그런게 부담스러운 사람에게는 비추합니다. 과제가 시간을 꽤 요하고 귀찮긴 하지만 학점 잘 받고 싶으면 추천합니다.	9
시험이 없는게 장점이긴하나 과제가 생각보다 많아요 개인적으로 마지막에 하는 브이로그가 제일 부담스러웠어요... 주제 정하고 스토리보드 짜고 편집하는게 꽤 힘들었어요 영상 블로그 팟캐스트 등등 만드는걸 좋아하시는 분들은 재밌을수 있는데 잘못하시는 분들은 비추입니다	9
일단 과제 정말 많습니다. 한 두번 빼고 매주마다 짜잘한 것부터 중간, 기말 성적을 위한 평가 과제까지 다양한 과제를 내주셔서 부담과 스트레스가 컸던 과목이였습니다. 블로그에 다양한 주제를 바탕으로 포스팅하기, 설문조사 하고 인포그래픽 만들기, 팟캐스트 영상 만들기, 밈 움짤 만들기, 브이로그 만들기 이런거 하는 수업이에요. 짜잘한 과제 내주실땐 괜찮았지만... 브이로그 같이 뭐 한시간만에 뚝딱할 수 없는 과제를 별로 기한도 길게 안주시고 하라고 내주실땐 정말 힘들었어요..ㅠㅠ 그래도 교수님께서 정말 열정적이고, 좋은 분이시라는 게 잘 느껴졌던 것 같습니다. 성적도 잘 주시는 듯 해요! 대체로 다른 영전은 실강하면서 토론해야 하는게 많은 것 같아서 이 과목을 선택했습니다. 물론 이 과목도 매주 최소 30분은 카메라 키고 줌 토론방에서 학생들끼리 얘기 나눠야 하는 시간이 있긴 했으나, 어려운 주제에 대해서 이야기 하는 건 아니였어서 부담이 크진 않았습니다! 즉, 영어에 엄청 능통하지 않으신 분이더라도 괜찮은 영전수업이라는 겁니당 그냥 영어 스피킹 실력 그냥저냥하시고, sns 관련 디자인 이런거 좋아하시는 분들이면 괜찮은 수업인 듯해요.	9
사람들과 토킹 좋아하고(영어 잘하는지와는 상관 없음, 저 영어 못함) 영상 만들고 밈 만들고 sns하는거 좋아하는 분께 강!추! 저는 약간 재밌었어요..	9
*2020 여름학기 수강생입니다루브릭 확인해서 시키는 것만 다 하면 과제 거의 다 만점 주신다. 루브릭이 정해져 있기 때문에 교수 성향 파악해 가면서 눈치보는 과목보다 나음. 영전/글로벌영역 채우기 좋은 수업이었음. 평소에 SNS 다루는 걸 좋아했다면 즐기면서 수업 들을 수 있을 것. 영어는 파파고 돌리면 되기때문에 크게 부담되지는 않는다.	9
할 게 조금 많기는 하지만 못 할 정도는 절대 아님! 애초에 교수님 친절하고 하셔서 크게 문제될 것도 없음. 하라는 것만 잘 하면 점수도 잘 주심. 영전 추천	9
과제가 다양하게 많은 강의임. 과제가 매주 있고 시간 꽤 잡아먹음. 또 까다로운게 예를 들어 영화 소개 글 쓰는 과제면 글만 쓰는게 아니라, 글 쓰고 블로그에 조금 꾸며서 사진이랑 올리고, 지정한 사람 글에 읽고 댓글 남기느라 은근 시간 걸림. 게다가 루브릭으로 채점하는데 조건이 정말 많고, 안 지키면 점수 팍팍 깎음.  팀플도 2번에 팀플할 시간 적게 줘서 힘들었고, 시험기간에 과제 배려 안 해줌. 특히 이번 기말고사 때는 시험 주에 기말과제 제출이라 다들 엄청 고생했을거임.. 과제 조건이 항상 많아서 그거 나오기 전에 섣불리 미리 준비하기도 그랬음. 열심히 하라는 거 다 해서 A+나오긴 했지만, 시간 많고 영어로 글 빨리 쓸 자신 있는 거 아니면 비추천함. 난 이 수업 때문에 이번 학기 꽤 힘들었음. 이렇게 시키는 거 많고 까다로운 교양은 처음이었음.	9
과제는 매주 있고 팀플 두번 있음. 인포그래픽, 블로그 만들기, 짤 만들기, 포토콜라주, 팟캐스트, 브이로그 다양한거 함. 발표도 없고 해서 영전 채우고 싶은 분들한테 추천.	9
수업 중 안내가 두리뭉실할 때가 많습니다. 영어 못하는 사람도 많이 들어서 소통도 좀 힘들었고요.. A0는 쉽게 나오는데 A+ 받긴 좀 빡셀듯	10
대충해서 성적 받을 수 있는 과목은 아님기본적인 스피킹 라이팅 안 되면 버거울 수 있음과제 양이 엄청 많진 않음시험은 없고 4번의 큰 과제 + 작은 과제들(짧은 글 주시고 소감문/질문에 대한 답문) + (출석)으로 성적 주시는데 너그럽진 않으신 듯다만 철저하게 가이드 따르면 A+ 받을 수 있음교수님도 좋은 분 같음!!진정으로 학생들이 비즈니스 월드에서 영어로 소통하는 기본적인 루브릭들을 배워갔으면 하시는 게 느껴짐실제로 실무적 차원에서 응용할 수 있을 듯한 것들 배워서 유익했음	10
영어 못하시면 비추입니다. 한학기 동안 이메일 쓰기, 전화통화하기, 미팅하기가 있는데 이메일 제외 다 팀플입니다. 외국인 유학생들도 있어서 영어 못하면 조금 따라가기 어려울것 같습니다. 대신 성적은 영어 능력보단 루브릭에 맞게 했는지를 더 보는것 같아요.	10
일단! 영어 배우고 싶으신분? 가지마세요 영어 안된다고 봐주지 않은 교수님입니다. 오티때도 영어가 안되면 수강 포기하시라고 합니다.시험이 없는 대신 과제가 몇개 있는데 총 4개라고 보시면 됩니다. 1. 비즈니스 세계에서 쓰는 이메일 양식 쓰기(제일 길고 제일 할거 좀 많음). 2.전화하는 방법 (파트너랑 전화해서 녹음한 다음 교수님께 제출 대본 써도 됨 진짜 ㄹㅇ 통화해야함 아이폰 유저들 주의). 3.비즈니스 미팅하는 방법(이건 팀플입니다. 교수님이 주제를 던저주시면 그 주제 관해 약간 토론을 한다고 생각하면 됩니다 대본X. 그리고 이거 평가 하는게 개인이 아닌 팀 평가라 본인이 아무리 잘해도 팀도 잘 해야 점수 잘 받습니다)4. 메모 쓰기. 학교 알림판 같은데 공지사항 아시죠? 그걸 영어로 쓴다고 생각하시면 됩니다. 교수님이 주신 양식대로 쓰시면 평 잘 받음!파트너,팀은 랜덤 배정입니다. 교수님이 다 짜요.조금 귀찮은 수업이긴 하지만 양식대로 하면 무난하게 A제로는 받을수 있어요 근데.. A+ 진짜 열심히 해야 받을수 있습니다.	10
제가 정말 많은 유익한 지식을 얻고 가는 수업입니다. 개인과제는 잘했는데 팀플은 점수가 잘 안 나와 에제만 받아서 좀 아쉬었어요..	10
ㅋㅋ걍 교수가 님 성적 부수려고 작정합니다 절대듣지마세요	10
본인이 영어로 말하고 쓰는게 어느 정도 된다면 추천 아니라면 좀 더 배우고 하시고나 다른 걸로 영역 체우세요. 나쁘지는 않았음 대체로	10
이번 학기에 이 과목만 에제맞고 나머지는 에쁠맞았습니다 LMS상에서 95 이상이라 안심했는데 에제라 점수를 손수 계산해보니 94.8정도 나오더라고요 교수님 정말 깐깐하시고 칼절평입니다 저는 수업도 맘에 들었고 팀플하면서 좋은 분들도 만났지만 기준 맞추는데 좀 피곤했어요	10
ㄹㅇ ㅋㅋㅋㅋㅋㅋㅋㅋㅋㅋㅋㅋㅋㅋㅋㅋ절대 듣지마세요 과제 빠짐없이 고생해서 냈는데 B+???영어 못하셔서 배우려는 마인드로 오지마세요 그냥 대학은 기업 학원이 맞는듯해요 최소 유학다녀오신 분이 오셔서 학점 받아가세요!!	10
배우는 내용이 별로 어렵지 않았고 다만 과제가 좀 많아서 귀찮긴 했다. 과제할때는 rubric을 잘 따르면 그대로 점수를 주심. 가끔 채점 사항이 좀 모호할때가 있지만 여쭈어보면 설명을 잘 해주심.	10
절평 교양에서 A0를 받을 줄이야... 글로벌언어 영역 채워야해서 억지로 들었는데 역시나 너무 어렵네요. 시키는 내용들 중에 어려운 것은 없으나 수업 내용을 하나도 못 알아들으니 힘드네요.. 영어 잘 하는 친구와 같이 들으시길 추천합니다.	10
교수님 굉장히 친절하시고 질문도 잘 받아주십니다학점을 떠나서 아주 많은 것을 배울 수 있던 수업입니다	10
과제가 많긴 하다. 근데 이거 과제할때는 겁나 욕하면서 했었는데 나중에 내가 진짜 영어로 업무메일을 쓸때 정말 도움이 많이 되었다.해외 영업이나 마케팅 쪽을 생각한다면 무조건 추천이다. 인생에 무조건 쓸일이 있을것이다. 시험은 없고 다 발표다. 큰 과제가 4번 있음. 그중 발표 두번. 교수님이 주신 evaluatiom 표만 보고 잘 따라가면 에이 이상은 받음. 추천한다	10
열심히한만큼 학점도 잘나옵니다. 영전 특성상 교수님이 주신 템플릿을 그대로 반영해서 과제를 하면 성적 보장되는거 같아요. 그리고 질문하는것도 친절하게 답해주시고, 과제 첨삭도 빠르고 자세하게 해주셔서 그걸 바탕으로 최종과제 제출하시면 만점 가능합니다.	10
온라인 수업이었지만 블랙보드 브레이크그룹을 통해 매주 팀플했다.우리 팀플하는 동안 교수님 점심드시는거 같았지만 ...ㅎ 교수님이 주어준 양식 제대로 지키면 점수는 잘 나온다. 단, 하나라도 빠트려선 안된다. 하나 빠트리면 거의 7~10점씩 까임무조건 교수님의 메뉴얼대로 해야함이번 학기 특성상 peer review는 없었다! (팀플 참여 잘 안한사람 거를 수 없음)일단 시험없어서 좋은데 과제가 꽤 귀찮... 그치만 나름 유용한 정보 많이 배웠다.	10
확실히 매주 할 게 많고 매번 팀플이 대부분이라서 조금 버거운 감이 있음. 교수님 과제 채점이나 피드백 보면 깐깐하게 보시는 편인 듯. 마지막 미팅 팀플은 팀 구성원에 따라서 점수가 갈릴 거라 생각함... 영어 잘하는 사람들끼리 하면 최고지만 그게 아니면 성적은 기대 안하는게 좋음	10
왜 꿀이라는지 모르겠음. 과제 채점 깐깐하고 평가마다 peer review가 있는데 절평임에도 불구하고 교수 평가보다 학생 평가가 훨씬 후짐. 제대로 된 평가를 하는것도 아니라, 휴대폰질 하다가 3/5정도의 점수를 투척함. 앞의 모든 과제를 만점받아놔야 같이 듣는 학생들의 학점테러를 견뎌내고 A+를 받을 수 있음. 영어 좀 못하면 A+은 커녕 A0도 절대 못받으니 다른 교양 들으시길. 영어 잘하더라도 다른 학생들이 원한품으면 그대로 처음 받는 성적 받을수 있습니다~ 쌩판 모르는 사이여도요~	10
교수님 ㅋㅋㅋ 아재개그 엄청나게 귀여우시고 얼굴은 디즈니캐릭터 도날드덕이랑 똑같이 생겼어요 ㅋㅋ 그 눈썹 올라간 화난 도날드덕 ㅋㅋㅋㅋㅋㅋㅋㅋ 영어 좋아하시면 무난하게 한 학기 보낼 수 있어요~ 역시나 꿀강의~! 그리고 수업 때 배우는 내용은 실생활에서도 마구마구 쓸 수 있어요~! 활용도가 매우 좋아요~	10
시험이 없는 대신 자잘한 과제가 많아요.하지만 시키는 것만 잘 하면 성적 잘 주십니다. 괜찮은 영전이었다고 생각해요.	10
정말 너무너무 좋았다. 시험없는게 진짜 좋지만과제에 우리 조원 평가를 다른 조원이 하는게 있었는데 교수님은 에쁠주신 반면에 다른 조원은 비쁠줘서내 학점에 큰 영향을 받음. 그것만 빼면 개꿀강	10
영어잘한다면 그냥 거저먹기수업대신 어렵진않은데 과제가많아서 좀귀찮음	10
글로벌언어 분야 교양을 하나 들어야해서 에타에 올라온 평을 보고 제일 평이 좋은것중에 하나인 이 과목을 들었습니다. 그런데 생각보다? 꿀은 아니었습니다. 의외로 하라는것도 많고 과제 채점도 깐깐하게 하시는 편입니다. 그리고 보통 영어 잘하시는 분들이 많이 와서 다들 영어 실력은 평균 이상입니다.  과제 여러번 있고 중간에 한번 조별로 하나의 주제에 대해서 토론 하는 식으로 다른 학생들이 보고 있는 가운데 교실 한가운데에서 영어로 해야합니다. 촬영도 합니다. 하지만 크게 어렵지는 않고 성적은 나쁘지 않게 주는 편인거 같습니다.	10
시키는  과제가 다른 영전보다 많다.  그리고 영어 잘하는 사람들이 많아서 채점도 깐깐하게 한다. 영어를  아주 못하는 편은 아닌데 요구하는게 많아  힘들었다. 영어에 아주 자신있지 않은 사람은 듣지 마세요. 얻어가는것은 분명히 있다...	10
꼭 들으세요!!!!! 출결+하라고 하시는 것만 잘하면 에쁠은 기본입니다!	10
본인이 영어만 잘하면 학점을 매우 잘 주십니다.	10
