과제 은근 귀찮은거 많음. 중간 기말 각각 한 번 독백 줌으로 함. 재밌기도하고 떨리기도 함. 연기 좀 못해도 나머지 과제만 성실히하면 a+나옴. 본인은 과제 하나 대충해서 a0나옴.	24
비대면이라 너무 아쉬웠지만 재미있었습니다 영어 못해도 추런드려요!	24
충분히 힐링되는 강의는 맞습니다 팩트입니다. 근데 지각 제출 및 사소한 감점요소들은 꼭 신경써서 확인하세요. 제가 좀 게으른 편인데 조금씩 감점당하다가 결국 A0 받았습니다 ㅠㅠ	24
교수님은 소통도 빠르고 학생들에게 적극적인 피드백을 많이 준다. 성적도 후하게 준다. 솔직히 영어 실력을 향상 시키는 수업인지 모르겠지만 수업 자체는 재미있고 과제는 많아도 쉽다.	24
ㄹㅇ 최고의 교양입니다 하는것만 다하면 점수 잘줘요 한가지 조심해야 하는건 과제 제출만 늦지만 마세요 거기서 점수 많이 깍여요	24
평소에 연기에 관심이 있어서 도움이 되긴 함. 하지만 꿀교양은 절대 아닌듯. 할 게 생각보다 너무 많고 학점을 잘 주시는 편은 아님. 영전 채워야 하는데 연기에 어느정도 관심있는 분들 추천.	24
평이 너무 좋아서 들었는데 전공이 버거우면 듣지 않는 것을 추천매주 과제는 하나씩 필수로 있고, 외국인 교수님들 특성상 중간기말 과제나 반영비율이 높은 과제의 경우 가이드라인이 깐깐한 편학점은 잘 주신 건지 아닌지 모르겠지만 절대평가 철저하고 쁠 채워주시지 않음정말 휴식같은 과목을 원한다면 비추연기에 관심이 많은데 영전 채워야하면 추천	24
말모? 진짜 너무 좋은 수업 ,,,, 대면이었으면 진짜 백배로 더 재밌었을듯 좋아하는 영화 연기해 볼 수 있어서 좋았음 과제는 꽤 많은데 교수님이 몇주전부터 미리하라고 알려주심 평가기준따라서 하기만 하면 점수는 잘 주시는듯 ?!?!?	24
이번학기 최고의 수업입니다!! 교수님 너무너무 좋으시고 질문드릴 때마다 다 상세히 답변해주세요. 비대면으로 전환돼서 중간 기말 제외하고는 다 녹강이라는 게 아쉽긴 하지만ㅠㅠ 매주 간단한 글쓰기나 영상 제출 과제 있는데 부담스럽진 않습니다. 시험은 독백 및 인물 분석? 등의 글쓰기로 평가되는데 재미있어요! 연기, 영어 좋아하시는 분들께는 빡센 학기 중 힐링할 수 있는 꿀교양입니다 (다만 영어를 정말 못하거나 엄청 소극적인 사람은 힘들 수 있어요)	24
최고최고최고최고최고 점수 잘주시고 질문 답변도 친절하게 잘 해주시고 정말 최고 꿀교양입니다...	24
에세이는 루브릭 맞춰서 잘 써내시면 되고 과제도 마찬가지입니다. 학점은 정말정말 잘주십니다	24
생각보다 할 게 많다고 들었지만 생각보다 할 게 많지는 않았고 정말 이 강의를 듣게 되어 보람찬 학기를 보냈어요 영어실력은 엄청 좋지 않아도 다 따라올 수 있습니다:) 계획을 짜고 미리 하는 습관이 있으면 과제가 부담스럽지도 않을 거고 중간 시험은 독백 연기 기말 시험은 파트너 연기입니다 연기는 처음 해보는데 교양임에도 불구하고 차근차근 알려주셔서 따라가기 쉬웠음 무엇보다 이 교양을 통해 영어 회화에 두려움을 느끼지 않게 되어 좋았어요 A+ 맞았고 잘 따라가면 성적도 따라옵니다 이만한 영전 수업도 없다고 생각	24
** 평가 방식-에세이 2회-에세이+독백연기 1회-2~4인 연기 1회-연기에서 1~2점 깎여도 에세이만 가이드라인대로 쓰면 만점주니 a+ 쉽게 받을수있음. 에세이도 워드 2~3 페이지정도만 쓰면되서 로드적음. 이외의 과제없음.** 총평 : 교수님 천사시고, 발음도 천천히 잘들리게 말씀해주셔서 영어 잘하지 않아도 수업참여 문제없었음. 연기에대해 알아보고 재밌었고 부담없이 a+ 챙긴 수업!	24
연기에 대해 배울 수 있어서 너무 재밌었어요! 강의 외에 다른 활동도 많이하고 팀플도 하는데 전부 좋았습니다 꼭 추천합니다!	24
저는 개인적으로 비대면이라 더 마음 놓고 재밌게 들은 수업입니다. (영어가 능통한 편이 아니라서 ㅠㅠ) 교수님의 즉각적인 피드백도 좋고 무엇보다 학생을 배려해주고 좋아하시는 게 눈에 보입니다 🥺❤️ 과제랑 실시간 연기가 있었는데 열심히 하면 점수 잘 주시는 것 같아요	24
출석이 진짜 중요함 ㅜㅜ 좀 아쉽다..수업이나 과제는 다 좋았음	24
쉘리 사랑해요💖 짜잘한 과제 많지만 어렵지 않아서 영전으로 추천하고 교수님이 너무 스윗하십니다ㅏ 그냥 교수님이 좋아서 좋았던 수업..! 대면이었다면 너무 좋았을텐데 아쉬워요ㅠ	24
그저 빛 셸리 교수님....정말 친절하시고 답변도 잘해주셔서 감동했습니다.독백때 실수를 좀해서 걱정했는데 다행히 다른 부분에서 다 맞아서 에이쁠 받았어요 ㅠㅠ이런 수업은 처음이라 조금 쑥스럽기도 했는데 대학에서 해본 수업 중에 제일 기억에 남지 않을까 싶네요 ㅎㅎ	24
연기에 대해서도 배우고 중간 기말 시험은 연기 과제로 대체. 이거 말고 프로젝트성 과제도 있음. 연기력보다는 구성 점수를 많이 보심이번학기에는 통싸강	24
코로나 때문에 출결을 확실히 하겠다는 명목으로 짜잘한 과제를 거의 매주 내주셨음, 그러나 금방 함.중간고사는 독백인데 어려웠음, 기말은 팀플로 연기하는데 기말은 온라인이라 더 개꿀된듯.	24
진짜 인기교양은 괜히 인기교양이 아닙니다~~꼭 들으세요~ 진심 너무 좋아용~~♡	24
너무 힘들고 어려웠던 수업 입니다..미안하다 이거 보여줄려고 어그로 끌었다...쉘리 교수님 수업 수준 ㄹㅇ 실화냐?? 진짜 한양대 최고의 교수님이다...진짜 쉘리 교수님은 전설이다 진짜...연기 한번도 해본적 없는데 교수님이 수업도 잘 지도해주시고 과제도 양 알아서 배분해주시며 학생들 진심으로 따뜻하게 대해주시는게 느껴진다..진짜 언제 이런 수업 또 들을 수 있을까 옛날 생각나고 뭔가 슬프기도하고 좋기도하고... 아무튼 쉘리 교수님은 한양대 세계관 최강자이시다 꼭 들어라	24
쉘리쌤 너무 착하시고 활동적인걸 되게좋아하세요영어실력보다 적극성, 활발한 성격인걸 중요시여기는 수업!영어 잘 못하는데도 에쁠받았어요!	24
인기강의 중 하나인 만큼 학점도 받기 쉽고 재미도 있습니당. 중간 평가로 독백연기 기말평가로 팀 연극하는데 당연히 영어로 해야되는데 외워서 하는거라 회화 실력 걱정 안해두 되여!! 사람들이랑도 친해질 수 있고 되게 좋은강의!! 대신 기말 평가때 팀플이 꽤 시간 투자를 해야되서 빡센학기에 듣는건 비추천ㅠㅜ	24
손가락 빠르면 신청하세요.아. 별 뜻 아니고. 인기강좌라서 손가락 느리면 못 들어요...인기강좌 이름값하는 수업이니 들어보는걸 추천합니다.	24
영어와 발표를 잘해서 그냥 에이쁠 먹은 과목재미있는 수업이고 교수님의 커리큘럼도 좋다!다만 듣다보니 교수님의 마음이 공감이 간다.연기를 하는 것보다 다른 사람 연기를 보는 맛에 듣는 과목	24
이번학기 한줄기의 빛,,앉아서 공부만 하다가 교양와서 웃고 움직이고 활동하니까 살아있음을 느낍니다 교수님도 정말 천사♡	24
색다른 경험! 중간고사는 3분 독백인데 연기점수는 거의 들어가지 않고 대본 및 대본분석이 더 많은 부분을 차지하고 있어 연기에 엄청난 부담감을 갖지 않아도 된다. 과제는 베끼지 않고 분량을 채운다면 만점을 받으실 수 있을겁니다! 기말은 팀 연기인데 여러분들과 함께 즐거운 시간 보낼 수 있어서 좋있어요!	24
들어서 너무 행복하고 좋은 수업이었습니다. 다양한 exercise랑 연기도활동도 하는데 수업 분위기도 단란하고 교수님께서도 스윗하셔서 너무 좋았습니다!! 중간 과제 독백연기 기말과제 단체 연기인데 부끄럼 마노이 타시는 분들께는 약간의 수치플이지만 그래도 한번 도전해볼만 하다고 생각합니다!!  졸업 하기 전에 진짜 꼭꼭꼭꼭꼭 들으시길!!	24
1학기의 빛이었다... 연기의 재미를 느끼게 해준 수업이었고, 조별 모임의 경우 연기를 하기 위해 모이는 것이다 보니 즐거웠다!진짜 명강의다. 졸업 전에 꼭 한번은 듣길 추천!	24
셸리 교수님은 천사십니다.....일학기때 정말 힘들었었는데 한주 끝 이 교양때문에 힐링이 될 정도로요... 너무너무 즐겁고, 과제도 전혀 버겁지 않았습니다 조별과제도 해본 것들 중 가장 재밌었고요! 정말정말 추천합니다	24
영전의 빛 오브 빛 갓셸리 교수님♡♡♡♡♡ 이 수업이 아니었다면 이번학기가 삭막할뻔했습니다. 중간은 혼자서 독백연기하는 거고 기말은 팀으로 연기하는건데 조원들이랑 합이 너무 잘 맞았고 다양한 분들과 잠시나마 친해질수있어서 즐거웠습니다! 다른 일반적인 팀플과 다르게 아카데믹한 압박감없이 같이 연기를 기획하는 팀플이다보니 더 팀플 같이 안느껴지고 재밌게 참여할 수 있었던 것 같습니다.	24
갓쉘리교수님!!!! 과제는 총두번/중간 독백+대사 분석(?)/기말은 조끼리 발표인데 어렵지도 않음 독백 걱정 많이 했는데 그럴 필요 없음 걍 즐기고 과제 낼 때 기한내로 내면 후하게 주심	24
갓-쉘리 평가기준 명확하고 점수 개잘줌레포트 두 번 쓰는 게 귀찮은데 교수님이 제시하는 평가 기준 잘 맞추면 레포트에서 점수 잘 안 깎임 연기는 주관적인 거라 모르겠지만 독백 연기 망했다고 생각했는데 만점 주신 거 보니 깐깐하게 평가하진 않는 것 같음 무엇보다 수업이 재밌었음 모두 영전은 영연기 들으세요^^	24
진짜 너무너무너무 재밌었고 대학생활 추억으로 남을 것 같아요. 점수도 잘 주시고 2학기때도 이런 수업이 있으면 바로 들을듯... 감사했습니다 쉘리 교수님	24
생각보다 할 것이 많아서..과제 총 2번 연기 시험 2번 각 시험에 따른 대본 분석, 느낀점 쓰기 같은 것들이 있었어요. 할 일이 많아 좀 힘든 것 빼고는 즐거운 시간이었습니다.	24
다들 너무 좋다고 하시는데 전 의외로 할 게 너무 많아서 은근 힘들었어요.. 그치만 나름 즐겁게 수강했습니다.	24
진짜 좋았어요!!! 다만 과제가 조금 귀찮을 수 있습니다! 영전도 채우고 힐링도 하구 교수님 너무 좋으시구~ 조원들끼리 친해지구!	24
진심 힐링교양... 금요일 아침 수업이었음에도 불구하고 행복했습니다ㅠㅠ 진짜 꼭 들으세요..!!ㅜㅠ	24
시험 두번 모두 연기하는거라 외워서 말하기만해도 충분. 학점도 넉넉하게  채워주고 아주 만족.	24
진짜 명강입니다! 점수는 에쁠은 아니고 에제까지는 잘 주시는 듯. 하지만 활발하신 분이거나 연기 하시고 싶은 분들은 정말 재밌게 들을 수 있습니다. 전 공대생이었는데 대학교 수업중 최고로 재밌게 들은 강의였어요! 갓갓쉘리♡	24
들을 수 만 있다면 꼭!! 들으세요!!!대학와서 제일 재밌게 들었습니다!	24
혜자 오브 혜자수업도 정말 재밌고 하는것만 다하면 에이쁠은 받을 수 있는 한양대 5대꿀강 중 하나	24
ㄹㅇ 개꿀임... 모든걸가진 강의 영전 절평 후한 점수 ㄹㅇㄹㅇ	24
너무너무 재미있고 영어를 많이 안해도 되는 수업이에요.수업 분위기도 너무 좋고 첫날에 다른 사람들이랑 서로 소개하는 시간이 있는데 그거 이후로는 덜 어색해져요	24
진짜 꿀잼꿀교에이쁠받았는데재수강해서 또 듣고싶습니다꼭 들으세요	24
꿀~~~~잼이에요사람들이랑 여러가지 활동하면서 수업이 진행되는데영어 못해도 할만하고 교수님이 워낙 또박또박 말씀하셔서 다 알아들을 수 있어요다만 너무 수줍음이 많으시다면 비추!	24
영어를 떠나서 연기라는 행위에 대해 진중하게 많이 알아갈 수 있는 좋은 수업이었고 교수님 역시 매우 좋은분이셨다.에이플 받았는데 노력한만큼 점수는 잘 나오는듯!기말 연기가 중요한듯 싶은것 같다.	24
영어로 자신감을 채울수있는 강의입니다.매시간 팀플이 있지만 초등학교 영어 액티비티 느낌입니다.시험은 두차례로 2분짜리 독백연기와 6분가량 단체연기가 있습니다.독백연기때는 캐릭터 분석과 대본 감정 분석을 부수적으로 해서 제출해야하고, 단체연기는 2차례 리허설 보고서와 필요 체크리스트가 부수적으로 따라옵니다.과제로는 여러가지 활동중 하나를 하는것인데, 영화리뷰, 이론가조사, 캐릭터분석(확장), 예술인의삶(아침에일어나자마자 기분이나 생각기록, 일주일에 한번 지금껏 안해본거하기)등중 하나 하는데, 문법같은것은 안보고 이강의가 전체적으로 그렇듯이 성실도를 봅니다	24
ㄹㅇ..꿀뀰꿀꿀 ㄲㄹ..정날 영어로 말이 영어연기개론이지 그냥 영어로 노는 수업임. 꿀.. 교수님이 일단 너무 좋으셔서 영어 잘 못해도 최대한 배려해주시고 쉽게쉽게 설명해주심. 수업 대부분은 활동적으로 개인이 참여하고 그주그주 수업마다 팀플을함.중간고사는 2분가량 독백연기인데 대사 보고해듀 상관 없어서 개꿀..기말도 한 팀 자유롬게. 만들어서 5~7분 연기만하면됨. 연기도 그냥 영화같은거에서 긁어서 하면됨.. 내자신은 과제 제출이랑 중간때 교숨이 시키는거 안해서 무려 4점이나 깍여...ao..맞은 스스로가 바보같지만 이수엄들은거에대해 절대 후회안함 한양대 절대적인 꿀강이라 생각함	24
솔직히 말하면 정말 정확히 뭘 배웠는지 모르겠습니다. 교수님은 적극적인 사람을 좋아하시고 좀 깐깐하십니다. 그리고 거의 다 교환학생이어서 영어가 어느 정도 돼야 들을 수 있습니다.	25
그 전 강의평들을 보고 수강할지 꽤 고민했던 수강자입니다. 교수님을 웃기는게 중요하다는 평도 봤었는데, 이번학기 수업을 들어본 결과, 그렇지 않습니다. 그냥 참여 열심히 하는게 중요합니다. 성평등과 관련된 주제를 다루는 만큼 여러 이슈에 대해서 적극적으로 의견 표명을 하면 되며, 교수님이 여성이시라는 점을 가만한다면 수업 내용에 여성 불평등이 조금 강조되는 바가 없지 않지만, 그렇다고 교수님이 이 이슈만 다루고 계시냐, 한다면 그것도 아닙니다. 남성의 불평등도 수업중에 다뤄지며, 만일 이런 수업 방식이 불편하다, 혹은 좀 깨고싶다 한다면 중간 발표 기간에 색다르게 남성 불평등에 대해 발표하시면 됩니다. 학점 잘 받았고, 시험 어렵지 않습니다. 매 수업마다 조별로 회의를 많이 하고 수업중 발표도 많아, 영어로 편하고 재미있게 얘기하고 싶다 하면 추천드립니다.	25
강의 내용은 조금 이해가 안되는? 부분들이 좀 있었지만 전반적으로 수업이 쉬워서 학점 받는 데에는 문제 없습니다! 매시간마다 조를 짜서 토의를 하는데 가벼운 분위기여서 영어만 잘하시면 되구요 :) 수업 시간에 발표 많이 해야 교수님이 참여 점수 주시니까 영어에 자신 있으신 분들께 추천합니다!!	25
흠 젠더 수업인데 듣다보면 조금 거슬릴수도 있기는한데 크게 신경안쓰고 넘어가면 됨. 참여 많이해야하고 수업에 외국인이 많아서 마지막 기말 그룹 팀플할때 조 잘걸려야함.	25
배우는 건 없지만 학점을 잘 주신다는 말에 동의합니다. 교수님이 너무 착하시지만 이 수업을 영어가 어렵거나 발표를 많이 하지 않은 사람들은 조금 어려울 수 있어요. 가장 중요한 건 교수님을 웃게 한다? 그럼 A0/A+ 받을 수 있는 가능성이 높아져요. 장난을 많이 치고 적극적으로 발표를 하는 게 가장 중요하고, 에세이 작성 할 때는 교수님 평가 기준에서 벗어나지 않으면 잘 받을 수 있습니다. 내용은 아주 뻔해요. 개방적인 사고를 가진 친구들에게 추천하고요 친구들이랑 성소수자, 성평등 등 관련 된 사회 문제들에 대해 토론 하는 걸 평소에 즐긴다면 오케이.	25
영어못할거면 안 들었으면 좋겠음. 수업마다 그룹토의2번인가 있는데 말도 별로안하고 계속 다른조원한테 발표 떠넘기는 사람들 진짜 많았음. 수업 자체에서 배우는건 별로 없고 코로나때문에 사람들 와이파이 왔다갔다 거리고 시스템도 잘 적응못했는데 교수님 똥고집으로 쓸데없이 깐깐하게굴고 그럼. 수업 난이도는 안빡세지만 감정노동이 리얼 헬임	25
진짜 이게 수업인가? 싶을 정도로 허탈했음 교수는 그냥 하는 거 없이 지 얘기만 하고 떠들다가 갑자기 우리끼리 얘기하라는데 수업보다는 토론에 가까움. 그리고 수업 참여에 있어서 적극적으로 참여하는 학생이 눈에 띄는건 당연하지만 이번 학기 조별 토론 같은 경우 사이버강의로 진행 돼 교수가 직접적으로 학생 개인의 참여도를 확인 할 수 없음에도 불구하고 그저 공식 발표 시간에 발표를 한 학생에게만 자신의 호감을 적나라하게 드러냄. 또한 강의 주제 자체에도 문제가 있음 영어남녀와 의사소통이라는 강의명과 달리 자신의 생각을 일방적으로 주입하고 설득하려는 태도를 보임. 듣다보면 정말 페미니즘을 위한 수업이라는 착각이 들 정도임. 그냥 좀.. 선 많이 넘는다 다신 듣지마라 죽어도 듣지마라	25
한양대학교  최악의 강의. 한 학기동안 개인발표1번 ,시험2번,팀프로젝트 발표1번, 몇 번의 기타 과제 제출이 있고 수업은  교수님이 수업좀 진행 하시다가 그룹 디스커션이 주어지고 조원끼리 토의 하는 게 주요 수업 방식임. 교수님이 설정하신 룰이 굉장히 많고 그것에 엄격하심.강의명은 영어와 남녀의사소통이지만 남녀의사통에 관한얘기는 초반에 몇주하다가 페미니즘 강의로 바뀜.토론주제가 자신이 좋아하는 영화가 뭔지 이야기하고 그 영화에서 리드하는 주인공은 누구인지 이야기 하시오. 이런게 대부분임 그러면 학생들은 뭐하라는지 다 알아듣고 ~영화를 자기는 좋아하고 남자주인공이 리드한다. 이런식으로 손들고 말함. 그럼 교수님은 좋아함.일단 본인이 수업시간에 손들고 질문하거나 그 날 주어진 그룹 디스커션에대한 자신의 생각을 말하는 스타일. 즉 적극적으로 참여하는 스타일 이 아니면 이 수업 절대 들으면 안됨.  교수님은 적극적으로 참여하는 학생은 대놓고 엄청 좋아하고 듣기만 하는 학생은 대놓고 싫어함. 매주 수업마다, 또는 수업 내에서도 자신의 기분 변화, 대하는 학생에따라 성격이 극명하게 바뀌는데 본인의 생각이나 감정을 굳이 숨기지 않고 학생들 앞에서 항상 말하시는데, 이것은 학생에 대한 평가도 포함됨. 잘 참여하지 않거나 잘 참여하지 않는다고 자신이 생각하거나 어쨌든 마음에 들지 않는 학생이 있으면  수업시간에 공개적으로 그 학생에 대해 언급하며 평가함. 심지어 마지막 팀프로젝트 발표에서는 어떤 팀의 발표가 끝난 뒤, 평소 수업시간에 적극적으로 참여했던 한 외국인 여학생에게 Thank you so much ~~를 연발하며 그 학생의 이름만 호명하며  정말 수고했다고 90%이상의 발표는 이 학생이 혼자 다 했다. 라고 언급하시는 등 자신의 생각을 숨기지 않으심. 다른 조의 발표가 끝났을 때 이 그룹 프로젝트는 다같이 화합하고 즐기라고 내준거라는 현실성 없는 말을 하시며 이전의 조를 다시 언급하시며 이 조처럼 한명이 혼자 다하는 발표는 하면 안된다고 다시 한 번 자신의 생각을 표출하심.	25
수업은 내용은 예상했지만 교수님 말하는거 보고 감짝 놀람;;; 어떤 남성분이 난 '죄송합니다'라는 단어를 자주 쓴다고 하니까 엄청 놀라시면서 그런 단어들은 남자가 잘 안쓰는 단어라고 하시면서  보총 남자들은 과격하고 미안하다는 말 잘 안한다고...  그냥 남자면 안듣는게 편할 것 같음	25
The class was awesome. Although I didn't get an A+, I really enjoyed the class.There were a lot of interesting things to learn.	25
중간고사는 따로 없는데 발표 한번이랑 퀴즈가 두번 있음. 근데 그 퀴즈마저 공부할게 거의 없고 ppt 10분컷 내면 무난하게 점수 잘 받을 수 있음. 수업은 별 거 없고 듣는둥 마는둥하면서 좀 자다가 디스커션 할 때 말만하면 됌. 마지막에 조모임과제로 영상찍는거 있는데 이게 점수의 관건인것 같음.  수업 자체가 유익하진 않지만 영어에 자신있다면 학점용으론 최고인 수업.	25
퀴즈두번 발표 하나 에세이 하나 조모임 한번으로 이루어진 수업.성적은 잘 나왔지만 할것도 생각보다 많이없었지만  교수님 강의 듣고 말도안되는거로 디스커션하라니까 스트레스받았음..	25
남녀 차별의 끝을 보여주는 강의.너무 교수 생각 위주의 수업이라 헛소리 대잔치. 내용은 개 쓸모 없음.마지막에 동영상 만들기 팀플 박터짐.절평인데 점수 올려서 주는 편이고 발표가 좀 많이 중요함	25
수업은 유익한 얘기 50퍼 헛소리 50퍼임성적 잘 안줌막 나서서 발표하고 말해야지 교수님이 좋아해줌그러 국제학부 학생들이 학점 쓸어감발표1 팀플1퀴즈2 였는데 팀플은 거의 수업시간에 해결되고 발표만 준비 좀 하면됌성적 잘 안주심	25
학점은 하라는거 다하면 에이제로는 나올꺼임. 다만 수업내용이 남녀간 기계적 평등,  결과의 평등을 다소 과도하게 강조하는 느낌이 있었으며 마지막 영상 만들기 팀플은 수업시간에 해치우긴 하지만 어느정도의 창조성과 편집기술이 필요하니 꽤 귀찮음. 그래도 언어쪽 교양 채우기엔 괜찮다 봄.	25
절평이지만 절대 학점 잘 주는거 아님 . 그래서 절대평가인가봄남자가 들을시 눈살을 찌푸리게되는 경우가 허다함.수업은 유익.	25
퀴즈는 생각보다 지엽적으로 나와서 세세한 숫자 외워야됨. 근데 갓미미 명성대로 되게 쉽게 가르쳐주심! 퀴즈 두번에 파이널과제 하나 있는데 이게 진짜...1점깐 원인... 진짜 팀 잘못걸리면 개빡침. 귀찮기도 귀찮고ㅎ 영상편집 잘하는 사람 있음 개꿀임	25
무난하게 잘 따라가면 좋은 결과가 있습니다!퀴즈가 두번있는데 부담은 없어요	25
강의 내용은 유익했습니다! 제 개인적으로는 수업도 정말 재미있었고 무엇보다 미미 교수님이 정말 착하시고 좋은분이세요. 의견 말하거나 발표할때 잘 들어주시고 긍정적인 피드백도 많이 주세요! 퀴즈 공부 해가고 발표 몇번하고 어느정도 열심히하면 에이쁠 주십니다ㅠㅠ미미님 수업 너무 좋아요	25
간단한 퀴즈 두번, 개인 발표&라이팅 한번, 팀플로 영상 만들기 한번 있고 강의 내용은 강의명 그대로에요. 나름 흥미롭고 5-6명씩 둥글게 앉아서 교수님께서 주신 질문에 간단한 토론도 중간 중간 하는데 재밌었어요ㅋㅋ 학점은 절평이기 때문에 출석 잘하고 할 일 해가면 웬만하면 에이 제로 이상 받습니다.	25
학점 잘 주는거 아닙니다. 영어전용 강의 중 최악의 강의.. 남자면 안듣는걸 추천함	25
킹 미미교수님 충성충성충성 팀플로 영상만들기있고  퀴즈 두번 발표과제있음 출석은 직접호명함	25
배우는건 없지만 학점은 잘 주셔요..!!!	25
영어랑 스포츠를 좋아하면 추천합나다! 수업시간애만 공부하면 따로 셤준비를 하실필요없습니다! 발표가 한번있지만 중간고사 대체입니다!	26
할건 좀 있는데 평가 기준이 높지는 않아요. 영어로 일상 대화 정도 할 수 있다 싶으면 충분합니다. 교수님이 매우 친절하시고 스포츠 상식을 쌓을 수 있는 좋은 강의입니다.	26
평소 스포츠를 좋아하시는 분이라면 강추! 잘 알지 못했던 종목에 대해서도 조금씩 알게 되었네요. 성적도 노력하신 만큼 받을 수 있는 강의라고 생각해요. 교수님도 되게 좋으신 분이에요.	26
