이번학기부터는 소문나서 그런지 잡기 빡세진 모양임.	수업 부담없고 한거에 비해 학점 잘나오는 편이에요	출결 그냥 엄청 프리하시고 수업 안들어도 뭐라 안하심. 근데 재밌어서 듣게 되는 수업. 팀플이 제일 관건인데 독강말고 친구들이랑 같이 들으시길.	강의 레알 겁나 재미있어요. 저처럼 바다에 관심 있는 사람이면 강의 시간에 자고 싶어도 바짝 듣게 될 정도로 재미있어요.
교수님 관대하시고 수업 일찍 끝내주세요.
팀플하고 개인 리포트 합산해서 점수 주는데 둘 중 하나라도 최상위권이면 그냥 에이쁠 나가요.
개인 리포트 얘기 많은데 저는 진솔한 이야기 곁들여서 성의껏 조사한 내용 꼼꼼히 기술했더니 팀플 잘 못했는데도 에이쁠 받았어요

진짜 강추. 교양다운 교양!	교수님 정말 좋으신 분이고, 수업도 문과생들한테도 쉽게 접근할 수 있도록 설명해주십니다.
팀플도 너무 지루하게 피피티만 읽는게 아니면 에이쁠 에제는 받을 수 있을 것 같아요. 
레포트 쓰는게 하나 있었는데 평가기준을 역시 잘 모르겠습니다... 창의적이고 독특해야 점수 잘 받을 수 있을 거에요.	일단 과제 부담없는 꿀 교양이고 교수님이 큐티하십니다.  시험 없고 조별 한번 레포트 한번 있으며 점수는 공개 하지않아 조별  과 레포트 모두 열심히 하시는 것이 좋습니다. 쁠 채워주셔서 A+ B+ C+ 로 주시고 조별과제 1-2등 나머지 레포트 5-7명 정도 A+ 주는 구조 입니다.처음에는 똘끼있는 친구들이 잘 받아가는 교양이래서 걱정하다가 수강 신청했고, 조별 발표때도  다들 너무 똘끼(?)넘치셔서(칭찬이에요) 저희 팀이 잘 했다고 생각 되어도 걱정이 많았습니다.  그래도 조별 발표는 교수님과 학생들이 모두 채점하는 방식이라 너무  웃기기만 한 것 보다는 독창성과 재미 내용 골고루 갖춘 것이 평가방식에 적합하여 A+ 받을 수 있었습니다. 저는 혹시 몰라서 레포트도 독특하게 만들어 갔고 교수님이 오! 라고 하셨지만..조별발표로 A+받아서 레포트 열심히  한게 아쉽네요. 창의력을 많이 보시는 것 같지만 평가  기준도 어느 정도 세워져있습니다.	일단 시험이 없으니 수업을 열심히 들을 부담 없다는 점에서 개꿀강의. 중간고사는 조별발표대체, 기말고사는 개인레포트대체인데 조별발표는 조를 잘 만나야함. 그런 의미에서 독강 비추... 팀 꾸리기도 힘들고 웬만하면 친구 한 명 데리고 듣길 개인레포트는 인포그래픽 혹은 카드뉴스 형식으로 제작. 그리 어렵지 않음. 에이쁠 감사합니다 교수님 충성	중간 조별과제 진짜 폭망하고 기말레포트도 썩 잘한거 같지 않은데 A+ 나옴......기말레포트는 카드뉴스나 한장짜리 포스터?같이 하는거였는데 카드뉴스로 해서 형식을 좀 특이하게 하긴함 
중간발표를 정말 최악으로 해서 최대 b+ 예상했는데 A+ 떠서 좀 당황함
수업 내용도 꽤 흥미롭고 시험도 없어서 정말 교양 쌓는다는 느낌으로 가볍게 들을 수 있음
아마 이 수업을 듣는 사람들의 가장 힘든 점은 팀플이 아닐까싶다 중간조별발표때는 정말 별의별 발표가 다 나오고 학점을 향한 눈물의 똥꼬쇼가 펼쳐짐 보는건 재밌음..
개인적으로는 친구와 같아 듣는걸 추천함 ㅜ 독강이라 좀 힘들었던 점이 있었어서	똘끼 있는 조만 꾸려지면 최고의 강의. 
독강에 조 못꾸리면 많이 힘듦. 
시험은 중간 팀플,  기말 레포트(카드뉴스 형식)

출튀 굉장히 너그러우심. 가끔씩 감상문으로 출석 대체하실 때 있으니까 그것만 조심.	굳 넘좋다  한번들으세요ㅇㅇㅇㅇㅇㅇ꿀강입니다!!!!!	똘기 넘치는 친구들이 잘받아가는 수업입니다.  본인의 똘기를 최대한 발휘할 수 있으시다면 꼭 추천드립니다	출취 많이 했는데 교수님이 출석 부르는 날만 골라서 안해서 출결 다 채우고 레폿이랑 발표 참신한 컨셉으로 하니까 바로 에이쁠 나왔다 독강이어서 팀플 독강하는 쩌리들만 모였는데 다들 꿀빨러 온 거 알고 학점 중요한 몇명이 욕심버리고 캐리하니까 스트레스 안받고 좋았다	개꿀~~~시험도  없고 과제 적당히 발표 한 번만 하면 당신은 이미 에이쁠  부담 하나도 없고 잘 쉬다 오면 됨	나의 대학생활 중 가장 꿀빤 강의. 수업 안빠지고 출석만 꼬박꼬박하면서  수업 때 편하게 앉아서 쉬고 팀플 무난히 넘기고 마지막 기말 때 리포트 좀 신박하게 하니깐 어머 에이쁠이네?	중간 팀플있고 기말은 레포트 일단 과 친구들이랑 여럿이 들으면 팀플은 무난무난하고 과제는 명확한 기준이 없어 조금 힘들었다 ㅠㅠ 그래도 교수님은 너무 좋으심!! 그래서 4점,, 씨쁠이지만 ㅋㅋ	시험 없고  과제로 대체  / 팀원 잘 만나서 팀플만 무난하게 잘하면 최소 b쁠?  / 과제제출 한번 안하고 결석에 지각도 몇번했는데도 A+받음  같이 수강한 동기들도 만족도 100  교수님이 너무 좋음 ㅠㅠ	중간 조별과제 한번, 기말 개인레포트 한번. 출튀에 대해서 굉장히 유한 편이시고 인생 재밌게 사시는거같음. 나는 C+ 받았지만 교수님이 너무 좋아서 총평 4점 생각함.	교수님도 재밌고 수업 안들어도 중간 팀플 기말 레포트에 연관 하나도 안돼서 수업 안들어도 상관은 없지만 수업이 엄청 재밌어요	흠....성실한 거랑은 별개에요! 인생은 도박이다! 라고 생각하시는 분은 추천. 그 이유는 16주 중에 딱 1번 잘하면 되용	시험없는거 꿀 그래도 듣지마 무난하게 비쁠받기 ㄱㅊ 점수 기준이 없어서 짜증남	시험이 없어서 신청한 과목인데 다른분들 말대로 학점주는 기준이 뭔지는 모르지만 일단 중간고사 레포트 과제 무난해도 팀플에서 엄청 튄다면 좋은 성적 나오는듯	솔직히 불만이 많이 나올 수 밖에 없는 수업구조
얼마나 참신하고 남들과 다르게 준비하는지가 크게 작용함
그저 똑같이 외우고 시험보는 학습과정에 익숙한 친구들은 신청ㄴㄴ
다만 아이다어 좋고 번뜩이는 참신함이 자신있는 사람이면 에이쁠 보장	희대의 쓰레기강의. 성적나누는데에 명확한 기준이없음, 매우 주관적인 평가.
고학번점수 높게주는것 같음.	출결은 전자출결이고 수업도 안들어도 문제가 없어요!!
이번학기에는 교수님이 출장(?)이 많으셔서 다큐멘터리 보고 감상평쓰고 나오는 시간이 많았는데 다큐멘터리 다 안보고 마음껏 상상력 발휘해서 주제맞춰 한페이지 정도 쓰고 일찍 나와도 되는 거였어요. 과제는 주제주시고 그에 맞춰 발표제재를 자신이 정하는 건데 수업 끝나고 다들 4층인가 5층인가로 폭풍 질주하는 모습을 보실수 있을 거에요..ㅇㅂㅇ.. 과제는 거의 특별한 경우가 아니면 다 비슷비슷한 점수를 받는다고 교수님이 말씀하셨고 사실 팀플이 성적의 핵심입니다. 열의있는 팀 구성원들을 만나시는게 좋고 다들 팀플에 목숨(?)걸고하기 때문에 창의성 등에서 골치좀 아플거에요. 그래도 꿀강의라는거 보장합니다☆	수업내용 안들어도 상관없어요! 다큐 본 날에는 항상 어떤 질문 던져주시고 그 질문에대한 답을 자신이 생각한 대로 쓰면됩니다! 중간고사는 개인 레포트 작성하시면되고 기말에는 팀플 발표있습니다!	부담없이 들을 수 있는 교양수업.
중간고사는 과제대체,  기말고사는 조별발표로 대체해서 부담이 없음
따라서 수업과 시험은 관련되지 않음
학점은 +다 채워주시지만 수강자들이 발표를 대단히 잘해서 a+은 맞기 힘들수도 있음
그래도 거의 최소 b+은 받을 수 있는 꿀교양.	수업 안들어도 됨
중간대체 리포트 / 기말대체 팀발표 있는데 수업내용과 무관함
출석은 4번까지만 봐주고 그 이후로 에프 주심.
학점은 채워주시는데 비율 딱딱 맞춰주심