꿀강이고 수업은 그냥 토크콘서트 왔다 생각하고 들으면 됩니다. 피곤한 사람은 맨 뒷자리 앉아서 자라고 말해주는 교수님… 수업도 재밌고 부담도 없어서 좋습니다. 다만 팀플 발표가 너무 자유형식이다보니 어느정도로 해야하는지 잘. 모르겠다는 단점이 있어요. 발표날 보면 준비 엄청나게 해온 팀들이 있습니다…!	큰 수고 없이 비쁠 받고 싶다면 최고의 강의이지만 에이쁠을 노리고 들어온다면 모호한 평가방식+ 출결 반영 0%로 인해 마음고생을 꽤나 하게 되는 것 같습니다. 중간고사 기말고사를 개별평가해서 각각 상위 20%에 에이쁠 부여하신다고는 하는데 평가기준이 교수님 마음이니 무조건 눈에 띄는 수 밖에 없는 것 같아요. 성적 나올때까지 가장 마음 졸였던 과목이 아닌가 싶습니다.....	정말 너그러우신 교수님.. 너무 좋음
과제는 주제가 참신하면서도 적합한 게 중요한 듯 
에쁠 받고 갑니다 ~	수업내용 좋습니다. 다만 시험이아니라 과제랑 발표라서 줄만들이 좀 있으신 것 같은데, 누가봐도 잘햤다 싶으면 에쁠 나옵니다. 에쁠비율도 많고. 개인적으론 최고의 강의중 하나	출결 신경 안쓰심
레포트랑 발표로 정해짐
분명히 잘 한거 같은데 어디선가 마음에 들지 않았나봄
그런데 그 기준이 무엇인지 의문이 들기도 하다
편하긴 하지만 여러모로 의문점이 맘ㅎ은 수업	결과적으로는 에에쁠 받았지만 제일 성적 스트레스가 컸던 과목…
혼자 독강이라서 친구 없이 거지같은 고학번 선배님들과 함께 팀플했는데 자료조사 피피티 다 혼자 만들고 발표대본 써줘서 그거 좀 읽으라니까 발표 말아먹고…
진짜 끝까지 위장 뒤틀릴 스트레스+교수님의 모호한 평가방식으로 걱정이 엄청 많았습니다ㅠ
이강현 교수님 보고 있다면 평가방식을 제발 좀 바꿔주세요.
메일로 중간/기말 상위 몇 명씩 에이쁠 가져가는 건지 물어도 자신도 모르겠다고 하시고..
성적 정정은 안된다고 하시고
그냥 수업 계획서에 써있는대로 중간 30 기말 40 학습참여도 20 출결 10 이렇게 하면 될 것 같은데
왜 이렇게 평가하시는지 모르겠음
그래도 에이쁠 주셔서 감사한 마음으로 그동안의 고생 잊으려고 합니다..
한 학기동안 얻은 거라고는 인간혐오+생각보다 발표에 진심인 학우분들이 많다는 점 이거 두 개밖에 없었습니다.
교수님 자체도 수업에 큰 의미를 두지는 않으시는 듯.
결석 4번까지 오케이인 부분에서 그냥 걸렀어야 했는데ㅠ
큰 수고 없이 비쁠 받으시고 싶은 분들만 들으세요.
40퍼 에이쁠 퍼주고 자신이 얼마나 노력하든간에 이것저것 안 맞으면 맘고생이 심합니다..ㅠ	쁠 체워주는게 위험할 수도 있음
수업
들을필요없음
출튀 쉬움
발표 올인..	강의는 하나도 안들어도 되지만 중간레포트와 기말조발표가 중요합니다 중간 상위 몇명과 기말 상위 몇명은 아묻따 무조건 A+입니다 에제 비제같은거 없고 무조건 에쁠과 비쁠로 점수를 주십니다 
이 시스템이 아쉬운게 개인의 노력은 최소 에제라고 하더라도 너무 잘해버린 몇명이 에쁠 자리를 가져가기 때문에 밀려날 수 있습니다
더해소 기말조발표를 잘 준비하세요 조발표가 교수님 평가 + 학생 평가 반반으로 반영하기 때문에 본인이 아무리 열심히 준비했다고 하더라도 조원들의 발표 능력이 부족하거나 발표 자체가 재미가 없다면 학생들의 얄짤없는 평가가 이루어집니다 그리고 그냥 발표 안 듣고 점수만 쓰고 출튀하는 학생들이 많기 때문에 학생평가 부분을 크게 반영하는 게 좀 아쉽습니다 ㅠㅠ
아무튼 개인의 노력보다는 조 운빨이 중요하여 ㅠㅠ 생각보다는 노력하셔야 하거나 오히려 노력을 안해도 꿀빨수도 있습니다	진짜 수업 열심히 참여하고 성실하게 다 했는데 기준이 명확하지 않고 추가점수를 줬다고는 하지만 기준도 없고 구체적인 점수도 알려주지 않음. 걍 에쁠일줄 알았는데 장학금 받을 생각에 설래는 맘이었는데 이 마음에 비수를 꽃아버림.. 걍 너무 아쉬워서 화가날 따름.. 화나네 내 에이쁠..	시험이 없으며 중간고사는 대체리포트, 기말은 팀츨이었습니다. 팀플 조 구성이 중요한것 같습니다. 강추합니다	교수님이 학생들 배려를 정말 잘해주십니다! 인성이 정말 좋으신 것 같아요!	강의 내용은 환경에 관련된 강의를 계속 해주십니다. 수업은 굉장히 자유로운편이고 성적은 오직 중간 대체 과제와 기말 조별 발표로만 평가합니다	수업은 되게 프리합니다. 교수님의 수업을 들으면 재밌게 흐름을 타며 전체적인 스토리를 이해할 수 있어요. 성적관련 과제나 시험은 부담이 적습니다!	교수님이 학생들 배려를 너무 잘해주세요 최고에요	수업도 1시간만에 끝내주시고 시험도 대체과제 및 팀플로 대체여서 좋습니다	교수님 너무 친절하시고 수업도 재밌습니다 교양 꼭 들으세요	꿀강이에용 강의 내용과 크게 상관없는 대체 과제 내면 되는거임	레포트 작성만 잘 하시면 무난하게 성적 얻어가실 수 있습니다.	개인레포트랑 팀플 중 1개만 잘해도 A+ 받을 수 있어요.
부담감 없이 듣기 좋은 강의
꿀강입니다	전자출결이고 수업 빨리 끝내주셔서 강의 들을 때는 정말 꿀강입니다 중간 기말 과제들은 좀 귀찮긴 한데 한 주 정도만 열심히 하면 되는 것 같아요 팀플은 조원 잘 구하는 게 중요해요 친구들 모아서 같이 듣는 걸 추천합니다	레포트 주제가 참신하지 않아서 망했다고 생각했는데 열심히 쓰니까 에이쁠 주셨습니다
팀플 조원을 잘 만나는게 관건같습니다
친구와 함께 듣는걸 추천합니다	강의 듣기는 정말 편하지만
중간 기말 레포트/팀플 발표에 생각보다 많은 노력을 기울여야 합니다..ㅎ	교양으로서 부담없이 들을수 있어서 좋아요~ 학점도 잘주시고 나름 꿀강입니다	교수님이 너무 마음에 드는 수업 😘 팀플이 변수일 뿐 나머지는 다 좋아요	중간 기말 모두 대체과제로 진행하기 때문에 수업은 ㄹㅇ 안 들어도 됨. 본인은 그냥 수면시간으로 썼음
근데 중간대체나 기말 팀플은 강의평과는 별개로 꽤나 품을 들여야 했음. 품 안 들이다가 어중간하게 비플 받는 일이 많을 듯. 최소 비플만 받아도 만족한다는 사람에게 추천	너무 좋아요 시험을 안봐서 좋았고 대체 과제 두번만 해서 에이쁠 받았습니다. 고등학교때 발표 준비했던 거 경험 삼아서 과제 제출 했는데 성적 잘 주셔서 좋았습니다. 팀플 때문이 안 들으시려고 하는 분 많은데 1인조도 가능해서 팀플에 부담 안 가지셔도 될 것 같아요 아니면친한친구랑 같이 조 짜서 하시면 될듯합니다. 대신 기말과제는 영상 제출이었어서 1인조눈 약간 빡셀 수도 있을 것 같아요!	교수님 친절하시고 레포트 성의 있게 잘 쓰고 팀플 참여 열심히하면 좋은 성적 가능	꿀강맞고 성적 a0 이상 받으려면
중간과제 레포트랑 기말과제 자유발표에 좀 많이 열심히 노력해야할 듯	교수님 재밌고 시험도 없어서 꿀강인데
그만큼 점수 나오는 건 아님
중간 에세이 기말 팀플인데
에세이도 일주일정도에 나눠 분량 맞춰 작성하고
팀플도 잘했지만
비쁠	정말 재밌게 들었던 수업입니다. 중간에 레포트(어떤 형식으로라도 상관없음) 한 개와 기말 대체 조별 영상 과제 하나 있습니다. 부담되는 수업이 아니기 때문에 편하게 들으셔도 될 것 같습니다. 교수님도 굉장히 유쾌하시고 좋습니다.	강의는 열심히 안 들어도 상관이 없습니다
기말 중간 대체과제만 열심히 해도 성적은 잘 나올듯
저는 재밌게 놀면서 비쁠 받았어요	음 중간 대체에 힘을 더 뽝 줄 걸 그랬습니다.. 그래도 성실하게 잘 제출하고 하니 B+ 받았어요	진짜 최고의 꿀교양입니다!! 중간은 대체레포트고, 기말은 조별발표입니다. 같이 듣는 친구없어도 자기PR할 시간 주시니까 걱정안하셔도 됩니다. 교수님도 너무 친절하세요ㅜㅜ꼭 잡으세요!! 강추!!	본인이 좀 창의적이다! 하시면 추천해요 !! 제 기준에는 완전 꿀강이었답니다	교양을 고민중인 공대생들을 위해 짧게 적고간다. 공대생이면 피해라.	중간 대체 과제
기말 조별 발표영상 제출
수업 하나도 안들어도 가능한 것들이라 개꿀
근데 중간과제를 내가 못했나봄 ㅠㅠ 비쁠 ㅠ	진짜 꿀교양 시험이 없어서 부담도 적고 학점도 잘 주심 교수님 정말정말 친절하심!	꿀강이 반드시 필요할 때 잡았던 수업이라 도움이 될까 하는 마음에 강의평 쓰러 왔습니다. 우선 저는 에이쁠 받았습니다.
수업은 과목명에 걸맞는 내용으로 하시는데 시험이 없기 때문에 부담 없이 출결 한다는 생각으로 듣기만하면 됩니다. 중간에 한 번 정돈가 수업 내용에 관한 의견쓰기를 내신 적 있는데 그것 또한 가볍게 써내시면 됩니다.
시험 대신 중간에는 대체 레포트를, 기말에는 팀플 발표를 진행하십니다. 수업한 내용을 알아야 할 수 있는 그런 과제들은 아닙니다. 교수님께서 주시는 주제에 맞춰서 세부주제를 정하고 다른 교양처럼 레포트 쓰고 발표영상 만드시면 됩니다. 저같은 경우에 양식이 독특했다기 보단 많이 안 할 거 같은 주제를 고르는데 집중했던 것 같습니다. 대체적으로 무난하게 해서 냈습니다, 들인 시간도 크지 않았습니다.
쁠이랑 비율 가득 채워서 학점 주시는 걸로 알고 있습니다. 교수님도 좋으시니까 잡았다면 편하게 잘 들으실 거 같아요!	갓교양.. 성적뜬거보고 감동해서 강평쓰러 달려왔습니다. 수업은 말 그대로 교양 듣는 기분으로 편히 들으면 되고, 중간에 개인과제 기말에 조별과제 해서 내면 되는데... 노잼인간이라 강평보고 특이한 거 좋아하시는 교수님이래서 걱정했는데 A+이네요 감사합니다ㅠㅠ 교수님 진짜 좋으시고 유쾌하고 학생들 배려 많이 해주시고... 진짜 최고...	진짜 교수님도 너무 너무 좋으시고 이번에 비대면이라서 수업에 대한 부담도 없고 시험이 아예 없고 과제로만 합니다!!	그냥 개꿀 너무 달달하다 학점은 어떻게 나올지 모르겠네요	시험이 없고 대체과제로 진행되어 부담이 크게 없는 강의이고, 비대면 강의라서 수업에 대한 부담도 전혀 없었던 강의입니다! 교수님도 친절하셔서 질문도 잘 받아주십니다.	교수님이 귀여우심 대체과제도 나쁘지않음 팀플이 있고 성적이 어떻게 나올지는 모르겠지만 만족함	흐음 평가기준을 알 수 없으니 꿀강이라고 할 수 있을지 ? 너무 자유롭게 기준을 제시하셔서 오히려 어렵게 느껴졌음	교수님 정말 최고십니다 .. ㅠㅠ 수업은 실강으로 진행했고 중간은 대체과제로 제출했습니다! 교수님께서 주시는 주제대로 피피티, 한글, 동영상 등 원하는 형태로 제출 해도 되고 대체 과제 하면서 개인적으로 재밌었습니다 ~ 기말은 조 짜서 동영상 제출하는건데 이건 혼자 해도 상관 없긴 해요 조 짤때도 맘대로 조원 정할 수 있어요 퀴즈는 딱 한번 있었는데 정말 어렵지 않은 퀴즈고 중간 기말 대체과제도 내용만 주제에 충실하면 학점 잘 주세요 굳굳	시험을 레포트랑 팀플로 대체하였고, 교수님이 굉장히 친절하시고 재밌으심 꿀교양으로 추천합니다!	교수님이 진짜 친절하시고 시험이 없다는 점에서 과학기술영역 꿀교양임	강의는 교수님의 유쾌함으로 재미있었고 중간대체과제랑 기말 조별과제가 있었음. 퀴즈 나오는 날 있으면 잘 챙겨서 하고 레포트 잘 쓰고 조원 잘만나면 완벽한 수업	전체적으로 교수님의 강의가 유쾌하고 핵심을 잘 짚어주셔서 유익한 강의였습니다.	그냥 개꿀이에요. 비대면수업으로 했는데 수업 하나도 안듣고 과제만 내서 좋은성적 받음	조별과제가 많지만 그것빼고는 재밌었습니당! 교수님도 너그러우시고 성적도 잘주시는편입니다아 강추까진 아니어도 추천드려용	수업 재밌어요^^
시험이 없어 너무 편하고 스트레스 받을 일 없습니다.
또한 교수님께서 학점 잘 주십니다.

코로나 때문인지
중간고사: 대체 개인 레포트
기말고사: 팀별/개인 발표 (영상 제출하기)
였습니다.

진짜 이 강의를 잡으세요^^	수업도 재밌어요. 교수님 굉장히 친절하십니다. 레포트 하나 조별과제 하나 있는데, 레포트는 수업 내용을 몰라도 주제만 듣고 충분히 할 수 있는 거였고, 조별과제도 마찬가지였습니다. 점수도 굉장히 잘 주시고 수업 듣기도 굉장히 편한 꿀교양입니다.	일단 시험 없는 게 너무 편하고 중간,기말 모두 대체과제인데  열심히만 하면 성적 잘 주십니다. 팀플과제가 있긴 하나 혼자 할 수도 있습니다. 중간 대체 과제를 정말 잘 하시면 기말 성적과 상관없이 성적 잘 주신다고 합니다	학점 너무 잘주심.
중간대체 과제나 기말대체 과제나 주어진 주제만 파악 잘하면 됌. 분량 그런거 다 상관 없음. 그냥 주제 파악만 잘하면 장땡.
다만 기말 대체 과제는 팀플인데, 영상 제작이었음. 영상 제작할 줄 아는 친구들이랑 같이 수업들으면 개꿀. 근데 혼자 조 해도 됌. 평소에는 2~3주 간격으로 과제 주시는데 그냥 출석확인용 과제임. 30분 이하로 끝낼 수 있는 과제들임	진짜 꿀강임 수업 하나도 안 들어도 됨 그냥 대체과제 열심히만 하면 쁠은 채워주시는 듯 교수님도 성실하시고 기말 대체과제때 조 선택이 제일 중요함 팀플 부담스러워하면 혼자 해도 되는데 개인적으로 팀으로 하는게 더 좋은듯	수업도 정말 부담없이 들으면 되고, 시험 없고 레포트 1개, 부담없는 글쓰기 1개, 발표 팀플 1개면 끝납니다 그저 빛 너무 좋았어요 교수님도 짱 착하시고 귀여우십니다 바다에 대해 몰랐던 면모를 많이 알아갑니다 굿구ㅠㅅ귯	강의는 개꿀. 학점은 개꿀아님.(잘주시나 팀플 비중높아서 공부한다고 잘나오는지는 모르겠어요)	수업 안들어도 되고 중간고사 과제 대체 래포트 작성 기말고사 팀플 영상만들기라서 팀원만 잘 만나면 개꿀 
환경에 대한 관심이 많이 생긴 과목	우선 시험이 없어서 수업 내용 안 들어도 상관은 없음.
중간 기말 과제 있는데, 중간은 개인 과제고 레포트 써서 내면 됨.
기말은 팀별 과젠데, 팀이 싫으면 혼자서도 가능. 
개인적으로 꿀 강의인듯	중간 레포트는 covid -19 펜더믹 이후로 바뀐 '바다'에 관련된 주제에 대한 레포트였습니다.  부담없이 재미있게 들을 수 있는 수업입니다.	줌 수업중인데 캠 키라고 강요하지 않으십니다. 수업에 학생들이 참여할 수 있도록 노력하시고 수업자료를 계속 만들고 업데이트해주십니다.	중간 과제 대체 기말 팀플 프로젝트 (혼자 해도 됨) 대체했습니다 시험이 없어서 수업시간에 긴장하지 않아도 되는게 좋습니다 기말은 바다 관련 영상물 제출이었는데 진짜 혼을 갈아넣었더니 무난히 A+받았어요 교수님 진짜 좋으세요 캠은 켜도 되고 안켜도 되는데 켜는걸 좋아하세요 추천합니다	레포트와 과제 신경써서내면 좋은 성적 받을 수 있음.	편하게 듣기 좋아요 쁠도 채워주시고 굳 두번인가 세번까지 빠지는거 봐주시고 학생들이랑 소통하려고 노력하시는 교수님인듯	너무 재밌었고 교수님도 매우 친절하십니다 성적도 예쁘게 잘 주셨습니다	학점은 40% 꽉꽉 채워주신다고 교수님께서 첫시간에 말씀하셨고요, 출석 두세번 정도는 빠져도 괜찮다고 하셨습니다. 중간고사 대체과제 열심히 했고 기말 조별과제도 열심히 해서 제출해서 에쁠 받았네요.
그리고 조별과제 하기 전에.... 조짜는거 진짜 신중하게 하시기 바랍니다.. 프리라이더가 너무너무 많아서... 과제의 65퍼는 저 혼자 다했네요.. 아니면 아는 사람하고 꼭 같이 들으시길!!!! 조원들만 잘 구한다면 완벽할 것 같습니다.	중간고사 대체과제, 기말 조별과제 열심히 하면 점수 잘 나옵니다.
기말고사 주제를 늦게 가르쳐주셔서 급하게 조별과제를 해야한다는 문제는 있지만
수업이 전반적으로 너무 재밌습니다.	교수님이 정말 좋으시며 학점 꽉꽉 채워주십니다
시험이 없기에 수업을 열심히 안들으셔도 됩니다
교수님께서 창의적인걸 좋아하시기에 리포트와 조별과제에서 임팩트 있는 모습을 보여준다면 좋은 성적을 받아가실 수 있을 것 같습니다	아래 사람들 말대로 개개개꿀강에 교수님도 천사시지만, 그만큼 경쟁자들이 박터져서 중간 대체 리포트나 기말 조별과제를 잘 해야만 학점이 나옵니다... 살아남을 자신이 있는 분만 들어오시길	꿀강 그자체. 시험 없어서 수업에 부담 전혀 없고, 출결 감점 기준도 널널.. 과제 있어도 1분 만에 끝낼 수 있음. 교수님도 친절하심. 다만 시험 대체 과제는 창의력을 요함.  본인은 에이쁠 맞았는데 그 이유가 과제의 퀄리티 보다는 흔하지 않은 주제랑 형식 때매 그런듯.. 팀플도 있고.. 아이디어 내는 거 싫어하거나 팀플 안좋아하면 안맞을듯한 교양. 우선 점수 기준이 굉장히 모호하기 때문에 그걸 고려해서 선택하시길	중간고사는 개인별 대체리포트
기말고사는 조별 영상 제작 이었습니다~
교수님 좋으시고..., 꿀강의 표본...🤗	진짜 교양  어렵지도 않고  교수님 잘 강의해주십니다
학점도 잘나오는거같아요	기말 고사는 조발표로 진행됩니다. 서로 친한 사람끼리 조를 짜야 결과물이 잘 나오는 것 같습니다.	중간고사 대체 레포트는 '바다와 인접해 있는 국가와 바다 관련 주제(예 : 대한민국의 해양 연구, 하와이의 해양 관광, 베트남의 해양 수산)'를 주제로 분량 없이 작성하는 것이었고, 기말고사 대체 발표는 '해양 오염'을 주제로 15분 분량의 동영상을 제작하는 것이었습니다.
수강 신청이 치열한 과목이니만큼 "열심히 하지 않는 사람이 없을 텐데, 내가 A+를 받을 수 있을까?" 걱정하실 수 있고 저 역시 걱정했지만……. 중간고사 대체 레포트와 기말고사 대체 발표를 끝내고 스스로에게 떳떳하기만 하다면, 누구나 충분히 A+를 받을 수 있었던 것 같습니다.
해양 생물과 해양 오염 등에 있어 많은 것을 알아갈 수 있는 '명강'이고, 한편으로는 부담 없이 수강할 수 있으며 A+와 B+ 모두 채워 주시는 '꿀강'입니다. 일단 붙잡아 보세요. 그리고 붙잡았다면 절대로 버리지 마세요!	개꿀강의 꼭 들으세요!!!! 재밌고 교수님 정말 좋으신 분... 체고	시험 없어서 사실 강의도 안 들어도 성적에 영향은 없어요...ㅎㅎㅎ 중간에 레포트 과제 하나 기말에 조별 영상 과제 하나있어요 일단 교수님 쁠 채워 주십니다 A+/B+/C+ 중에서만 주시는거 같아요 물론 출석 안 하면 F겠죠 학생들을 최우선으로 생각해주셔서 너무 좋았고 해양오염에 관심 있으신 분들 들으시면 좋을 것 같아요 전 너무 좋았어용 A+ 감사합니다 교수님 항상 행복하세요❤️	학기 끝날 때까지 성적이 가늠 안될 수 있지만 피피티 발표하는 것 외에도 참신함을 추가하려 하시면 높게 점수 주시는 듯 합니다 교수님도 좋고 시험을 안봐서 편히 강의 들으시면 됩니다	시험도 없고, 부담없이 즐기면서 과제 했더니 에이쁠! 왜 받았는지는 모르지만 감사합니다!	교수님이 학생들 부담 안주시려고 노력하시는데 성적기쥰은 잘 모르겠음 ㅜ	시험이없다!!! 대신 중간 기말과제로 성적이 나오는듯하다. . . 실강이 타강의보다 많은편임. 캠을 켜지 않아도 되지만, 교수님은 캠 켜는걸 좋아함. 강의를 듣지않아도 과제는 할 수 있다	관심이 있는 사람이라면 흥미롭게 들을 수 있는 강의이고 교수님이 매우 인자하시다. 좋은 교양강의 중 하나라고 생각한다	시험 없고 매주 있는 과제도 쉬워서 부담없음 근데 조별과제 운이 중요할 듯..	진짜 좋았음. 내용도 유익하고 팀플도 너무 재밌게 했음. 즐기면서 에이쁠 딴 과목.	다 필요없고 조가 가장 중요한 것 같음... 친구들이랑 함께 듣는 것을 추천해요 ㅠㅠ 조 잘못 만나면 중간과제까지 고생한 것들이 다 필요가 없어지는 것 같네요..	강의 내용은 유익하고 재미도 있다. 그러나 강의는 사실 출석만 하고 딴짓해도 성적엔 아무 영향이 없다.. 열심히 강의 내용을 듣고 그걸로 평가 받고 싶은 사람에겐 비추, 자기가 독특하고 톡톡 튀는 편이면  추천. 독강은 어지간해서는 안 했으면 좋겠음. 팀플 비중이 높다.	교수님이 너무 친절하시고 학생들과의 소통이 매우 잘 된다. 기말과제가 조별로 이루어지기에 친한사람 몇명과 같이 신청하면 매우 좋다. 수업 내용은 꽤 흥미롭고 부담없이 들을 수 있어 좋았다.	과제도 많지도 않았고 자세히 쓰지도 않았는데 A+받음 (교수님이 지정한 내용만 들어가면 됨 )
중간은 보고서 제출인데 특색한거 좋아하는거같음
기말은 UCC인데 이 또한 특색한거 좋아함 
스트레스 안받고 재미있게 들었던 수업	성적을 어떻게 주실지 몰라 걱정했고 매학기마다 과제 주제가 바뀝니다. 작년에는  중간 최고층이랑 기말 최고층 에쁠 줬다는데 이번엔 제가 둘 다 딱 보통이상정도 한거같은데 에쁠 주신거 보면 괜찮게 주신 것 같습니다. 과제 제출 방식도 엄청 자유롭고 주제도 자유로워서 걱정될 수 있고, 창의적인게 정말 중요합니다.	ㅁ친놈들 모인 수업이라면서 선배들이 겁주길래 학점안나올까봐 걱정했는데 그냥 바로 a+ 그렇게 독창적이지도 않았는데 그냥 앵간하게 했다라고 생각했는데 그랬음 들을민함	조별과제 열심히 했고 조원들이 다같이 협력해서 잘 해줬는데도 비쁠이네요..ㅜㅜ 중간과제 때문인 것 같은데 아무래도 독창성이 부족했던 것 같아요 학점 잘 받으시려면 내용도 내용이지만 창의성 있게 하시는게 제일 좋아요	교수님이 젊으셔서 그런지 융통성 있으시고 센스 있으심
싸강) 이번 학기 기준 중간은 개인과제 제출, 기말은 조별 과제였음
일단 시험이 없어서 부담이 1도 없음
시험 기간 안 겹치게 과제 내주셔서 좋음
학점도 잘 주십니다 그냥 하라는 거 다했는데 A+ 떴어요
조원 잘 만나면 조별 과제도 할 만합니다~	끼 많은분들 절대후회안함 비율은 꽉꽉눌러서 가득채워줌. 교수님이랑 친구하고싶어짐	흥미롭고 학점도 잘주심.  중간은 레포트 제출이고 기말은 조별발표. 참신한걸 좋아하심	평소에 바다에 관심이 있었던 분들은 강의 내용이 아주 재미있으실 겁니다. 시험은 없고 중간과제랑 기말팀플이 있습니다. 중간 과제는 다들 비슷하게 하시는거 같은데 팀플은 조원들이 활발하시면 아주 유리합니다.	교수님 정말 좋으시고 재밌어요. 최종 팀플 과제가 있기 때문에 친구랑 같이 듣는걸 추천해요.	교수님은 참 좋으신데 과목이 완전 팀빨 똥꼬쇼
우리 조원들 나중에 사회나가서도 그렇게 사세요^^	진짜 최고의 수업입니다. 부담없이 듣다가 갈 수 있네요. 팀만 잘 만난다면 수업듣다가 좋은점수 받아가실 수 있으세요	진짜 너무 개꿀이었던 수업!!!꼭 들으세요 대신 친구랑 같이 ㅠㅠ	개꿀이고 과학영역은 이거 꼭 듣길.
